title	pmid	doi	scopus_eid	pub_date
A guide for developing comprehensive systems biology maps of disease mechanisms: planning, construction and maintenance.	37426048	10.3389/fbinf.2023.1197310		2023-06-22
Bibliometric analysis of phosphoglycerate kinase 1 expression in breast cancer and its distinct upregulation in triple-negative breast cancer.	39071464	10.5306/wjco.v15.i7.867		2024-07-24
BioGateway: a semantic systems biology tool for the life sciences.	19796395	10.1186/1471-2105-10-S10-S11		2009-10-01
Evolutionary learning-derived lncRNA signature with biomarker discovery for predicting stage of colon adenocarcinoma.	40039814	10.1109/EMBC53108.2024.10781761		2024-07-01
Expanding automated gene summaries for Caenorhabditis and parasitic nematode species in WormBase.	39087205	10.17912/micropub.biology.001267		2024-07-16
Identification of GJC1 as a novel diagnostic marker for papillary thyroid carcinoma using weighted gene co-expression network analysis and machine learning algorithm.	40095160	10.1007/s12672-025-02137-7		2025-03-17
Identification of TFRC as a biomarker for pulmonary arterial hypertension based on bioinformatics and experimental verification.	39097701	10.1186/s12931-024-02928-6		2024-08-03
Identification of diagnostic biomarkers of rheumatoid arthritis based on machine learning-assisted comprehensive bioinformatics and its correlation with immune cells.	39170142	10.1016/j.heliyon.2024.e35511		2024-08-05
Identification of effective diagnostic genes and immune cell infiltration characteristics in small cell lung cancer by integrating bioinformatics analysis and machine learning algorithms.	39074893	10.15537/smj.2024.45.8.20240170		2024-08-01
Identification of key biomarkers and therapeutic targets in sepsis through coagulation-related gene expression and immune pathway analysis.	39430765	10.3389/fimmu.2024.1470842		2024-10-04
Integrated network pharmacology and RNA sequencing analysis to reveal the mechanisms of Qici Sanling decoction in the treatment of gemcitabine resistant bladder cancer.	40233549	10.1016/j.jpba.2025.116885		2025-04-10
Modulating vascular smooth muscle cell phenotype via Wnt-Independent FRZB pathways.	39778670	10.1016/j.abb.2025.110290		2025-02-01
Predicting gene signature in breast cancer patients with multiple machine learning models.	39352418	10.1007/s12672-024-01386-2		2024-10-01
Research on the Therapeutic Effect of Qizhu Anti Cancer Recipe on Colorectal Cancer Based on RNA Sequencing Analysis.	39501961	10.2174/0113862073322752241016110001		2024-11-04
TarKG: a comprehensive biomedical knowledge graph for target discovery.	39392404	10.1093/bioinformatics/btae598		2024-10-01
The 2024 Nucleic Acids Research database issue and the online molecular biology database collection.	38035367	10.1093/nar/gkad1173		2024-01-05
The G Protein-Coupled Receptor-Related Gene Signatures for Diagnosis and Prognosis in Glioblastoma: A Deep Learning Model Using RNA-Seq Data.	39733410	10.31557/APJCP.2024.25.12.4201		2024-12-01
The expression of exosomal and cellular miRNAs in predicting oxaliplatin resistance in colorectal cancer cells: an in silico and in vitro study.	39789474	10.1186/s12885-024-13392-2		2025-01-09
p27 Cell Cycle Inhibitor and Survival in Luminal-Type Breast Cancer: Gene Ontology, Machine Learning, and Drug Screening Analysis.	39344410	10.4048/jbc.2024.0107		2024-10-01
Fatty acid synthase inhibitor cerulenin hinders liver cancer stem cell properties through FASN/APP axis as novel therapeutic strategies.	39332525	10.1016/j.jlr.2024.100660		2024-11-01
Graph databases in systems biology: a systematic review.	39565895	10.1093/bib/bbae561		2024-09-23
Network-based hub biomarker discovery for glaucoma.	39537208	10.1136/bmjophth-2024-001915		2024-11-12
Tracking the Spread of Pollen on Social Media Using Pollen-Related Messages From Twitter: Retrospective Analysis.	39432897	10.2196/58309		2024-10-21
ANTICANCER ACTIVITY OF MELATONIN AND METFORMIN ALONE AND IN COMBINATION AGAINST MELANOMA AND BREAST CANCER CELLS		10.32383/appdr/197350	2-s2.0-85219476491	2024-01-01
A Multi-Omics-Based Exploration of the Predictive Role of MSMB in Prostate Cancer Recurrence: A Study Using Bayesian Inverse Convolution and 10 Machine Learning Combinations		10.3390/biomedicines13020487	2-s2.0-85218865395	2025-02-01
A genome-wide association study of high-sensitivity C-reactive protein in a large Korean population highlights its genetic relationship with cholesterol metabolism	39747571	10.1038/s41598-024-84466-1	2-s2.0-85213871947	2025-12-01
A semantic ontology of acupoints in Traditional Chinese Medicine aligning with the Basic Formal Ontology		10.1109/IIKI65561.2024.00039	2-s2.0-105001425620	2024-01-01
Background knowledge in ontology matching: A survey		10.3233/SW-223085	2-s2.0-85217958043	2025-01-23
Bridging the Gap: Generating a Comprehensive Biomedical Knowledge Graph Question Answering Dataset		10.3233/FAIA240615	2-s2.0-85213378742	2024-10-16
Comprehensive Metapath-based Heterogeneous Graph Transformer for Gene-Disease Association Prediction		10.1109/BIBM62325.2024.10821892	2-s2.0-85217276857	2024-01-01
Comprehensive evaluation of pure and hybrid collaborative filtering in drug repurposing	39837888	10.1038/s41598-025-85927-x	2-s2.0-85216550346	2025-12-01
CroMatcher 2.0: A Comprehensive Analysis of the Improved Ontology Matching System		10.1109/ACCESS.2025.3538655	2-s2.0-85217466415	2025-01-01
Data Hazards: An open-source vocabulary of ethical hazards for data-intensive projects		10.1016/j.jrt.2025.100110	2-s2.0-85218871754	2025-03-01
G0S2 modulates normal vitreous-induced proliferation in endothelial cells	40185884	10.1038/s42003-025-07955-7	2-s2.0-105002654474	2025-12-01
IDog: A multi-omics resource for canids study	39526388	10.1093/nar/gkae1031	2-s2.0-85214461054	2025-01-06
Knowledge Graphs in AI-Driven Biomedical and Chemical Engineering: A Survey of Construction, Applications, and Future Directions		10.1109/AIxSET62544.2024.00050	2-s2.0-85215095823	2024-01-01
Language Models as Hierarchy Encoders			2-s2.0-105000558096	2024-01-01
PDMMDA: Prediction of MiRNA and Disease Association Based on Parallel Dimension Reduction Structure		10.1145/3718677.3718695	2-s2.0-105002392033	2025-03-22
Predicting circRNA-Drug Resistance Associations Based on a Multimodal Graph Representation Learning Framework	37498762	10.1109/JBHI.2023.3299423	2-s2.0-85166278467	2025-01-01
Prediction of miRNA-Disease Associations Based on Hybrid Gated GNN and Multi-Data Integration		10.1109/BIBM62325.2024.10822161	2-s2.0-85217279824	2024-01-01
Prediction of miRNA-disease associations based on PCA and cascade forest	39701957	10.1186/s12859-024-05999-w	2-s2.0-85212584214	2024-12-01
Transcriptome Analysis of Peiminine-mediated Inhibitory Functions on Hepatocellular Carcinoma Huh-7 Cell Growth		10.13748/j.cnki.issn1007-7693.20230653	2-s2.0-85209211619	2024-09-01
VICatMix: Variational Bayesian clustering and variable selection for discrete biomedical data		10.1093/bioadv/vbaf055	2-s2.0-105003032962	2025-01-01
A Review of Link Prediction Applications in Network Biology		10.1109/ACCESS.2025.3553732	2-s2.0-105002264430	2025-01-01
Drug repurposing through molecular docking		10.4018/979-8-3693-5598-5.ch009	2-s2.0-85218142783	2025-02-05
Genetic associations of plasma proteins and breast cancer identify potential therapeutic drug candidates		10.1038/s42003-025-08046-3	2-s2.0-105002969904	2025-12-01
Identifying Associations between Small Nucleolar RNAs and Diseases via Graph Convolutional Network and Attention Mechanism	38980776	10.1109/JBHI.2024.3424848	2-s2.0-85198313789	2024-01-01
Integrative analysis of the fermentation mechanisms, antioxidant properties, and potential health benefits of mulberry wine using multiple bioinformatics approaches		10.1016/j.fbio.2025.106185	2-s2.0-85218885399	2025-04-01
MFF-nDA: A Computational Model for ncRNA-Disease Association Prediction Based on Multimodule Fusion		10.1021/acs.jcim.5c00174	2-s2.0-105003047111	2025-04-14
Navigating the Explainable Molecular Graph: Best Practices for Representation Learning in Bioinformatics		10.1109/BIBE63649.2024.10820484	2-s2.0-85217172555	2024-01-01
PPDAMEGCN: Predicting piRNA-Disease Associations Based on Multi-Edge Type Graph Convolutional Network	40120103	10.1049/syb2.70011	2-s2.0-105000668455	2025-01-01
Predicting circRNA-disease associations with shared units and multi-channel attention mechanisms	40045181	10.1093/bioinformatics/btaf088	2-s2.0-105000551934	2025-03-01
Predicting potential microbe-disease associations based on heterogeneous graph attention network and deep sparse autoencoder		10.1016/j.engappai.2025.110301	2-s2.0-85218466305	2025-05-01
Therapeutic gene target prediction using novel deep hypergraph representation learning	39841592	10.1093/bib/bbaf019	2-s2.0-85216608285	2025-01-01
metaCDA: A Novel Framework for CircRNA-Driven Drug Discovery Utilizing Adaptive Aggregation and Meta-Knowledge Learning	39937612	10.1021/acs.jcim.4c02193	2-s2.0-85217524666	2025-02-24
The role of ontologies in machine learning: a case study of gene ontology		10.47989/ir30iConf47575	2-s2.0-105000135729	2025-01-01
A cell atlas foundation model for scalable search of similar human cells	39566551	10.1038/s41586-024-08411-y	2-s2.0-85217270680	2025-02-27
A mode of action protein based approach that characterizes the relationships among most major diseases	40113859	10.1038/s41598-025-93377-8	2-s2.0-105000486582	2025-12-01
A survey on computational methods used for drug repositioning		10.1007/s13721-025-00502-8	2-s2.0-85217505216	2025-12-01
Advances in Bioinformatics, Biostatistics and Omic Sciences		10.2174/97898114818021200101	2-s2.0-85208012383	2020-01-01
Analyzing the relationship between gene expression and phenotype in space-flown mice using a causal inference machine learning ensemble	39824847	10.1038/s41598-024-81394-y	2-s2.0-85216237077	2025-12-01
BioSTransMatch Results @ OAEI 2024			2-s2.0-85216422049	2024-01-01
Data2Concept2Text: An Explainable Multilingual Framework for Data Analysis Narration		10.4204/EPTCS.416.13	2-s2.0-85218622044	2025-02-13
Differential Protein-Coding Gene Expression Profile in Patients with Prostate Cancer		10.3390/biomedicines12112509	2-s2.0-85210421918	2024-11-01
DisGeNet: a disease-centric interaction database among diseases and various associated genes	39797570	10.1093/database/baae122	2-s2.0-85215077040	2025-01-01
EHDChat: A Knowledge-Grounded, Empathy-Enhanced Language Model for Healthcare Interactions			2-s2.0-85216934377	2024-01-01
Ferroptosis-related genes in preeclampsia: integrative bioinformatics analysis, experimental validation and drug prediction	39984919	10.1186/s12884-025-07325-5	2-s2.0-85218493059	2025-12-01
Human Phenotype Ontology Annotations for Rare Congenital Conditions: Application to Arthrogryposis Multiplex Congenita		10.1002/ajmg.a.64067	2-s2.0-105002144293	2025-01-01
Identifying Disease-Gene Associations by Topological and Biological Feature-based Data Augmentation and Graph Neural Networks		10.1109/JBHI.2025.3549509	2-s2.0-105000052318	2025-01-01
Integrating large language models with human expertise for disease detection in electronic health records		10.1016/j.compbiomed.2025.110161	2-s2.0-105001855770	2025-06-01
LSD600: The first corpus of biomedical abstracts annotated with lifestyle-disease relations	39824652	10.1093/database/baae129	2-s2.0-85215369394	2025-01-01
Multiple disease diagnoses using heterogeneous EHR curated knowledge graph and machine learning models		10.1007/s10489-024-05952-7	2-s2.0-105002961613	2025-05-01
Ontology Matching Method Based on Gated Graph Attention Model		10.32604/cmc.2024.060993	2-s2.0-86000367016	2025-01-01
Potentially causal associations between placental DNA methylation and schizophrenia and other neuropsychiatric disorders	40087310	10.1038/s41467-025-57760-3	2-s2.0-105000172148	2025-12-01
SPHN strategy to unravel the semantic drift between versions of standard terminologies			2-s2.0-85214925030	2024-01-01
ZFIN updates to support zebrafish environmental exposure data	39903545	10.1093/genetics/iyaf021	2-s2.0-105000314154	2025-03-01
A Systemic Pipeline of Identifying lncRNA-Disease Associations to the Prognosis and Treatment of Hepatocellular Carcinoma		10.1109/TBDATA.2024.3433380	2-s2.0-105001062265	2025-01-01
A survey on multi-view fusion for predicting links in biomedical bipartite networks: Methods and applications		10.1016/j.inffus.2024.102894	2-s2.0-85213230332	2025-05-01
Advancing Liver Cancer Research: A Graph-Based Approach for Ontology Enrichment and Link Prediction		10.1016/j.procs.2024.09.313	2-s2.0-85213391567	2024-01-01
An investigation into the mechanism for Kaempferol improving melanocyte death based on network Pharmacology and experimental verification	40074768	10.1038/s41598-025-91905-0	2-s2.0-105000160823	2025-12-01
Automatic Pathology Detection in Spanish Clinical Notes Combining Language Models and Medical Ontologies			2-s2.0-85211928611	2024-01-01
Best practices for developing microbiome-based disease diagnostic classifiers through machine learning	40186338	10.1080/19490976.2025.2489074	2-s2.0-105002210667	2025-01-01
Causal relationships between diseases mined from the literature improve the use of polygenic risk scores	39460944	10.1093/bioinformatics/btae639	2-s2.0-85209168749	2024-11-01
Computational tools and data integration to accelerate vaccine development: challenges, opportunities, and future directions	40124369	10.3389/fimmu.2025.1502484	2-s2.0-105000469104	2025-01-01
Computer analysis shows differences between mitochondrial miRNAs and other miRNAs		10.18699/vjgb-24-91	2-s2.0-85217534712	2024-01-01
Core reference ontology for individualized exercise prescription	39695140	10.1038/s41597-024-04217-9	2-s2.0-85212448635	2024-12-01
Curcumin Analog J7 Attenuates Liver Fibrosis and Metabolic Dysregulation in a Rat Model of Type 2 Diabetes via Modulation of TGF-β/Smad and NF-κB/BCL-2/BAX Pathways	40190815	10.2147/DDDT.S511372	2-s2.0-105002446905	2025-01-01
Data Harmonization through use of community standards in the Common Fund Data Ecosystem			2-s2.0-85209948083	2022-01-01
Disease Clustering with Process Annotations from Gene Ontology		10.29007/sfh2	2-s2.0-85207844118	2024-01-01
Domain specific semantic categories in biomedical applications		10.1016/B978-0-443-15452-2.00029-7	2-s2.0-85213163553	2024-01-01
Editome Disease Knowledgebase v2.0: an updated resource of editome–disease associations through literature curation and integrative analysis		10.1093/bioadv/vbaf012	2-s2.0-85218712580	2025-01-01
EnrichDO: A global weighted model for Disease Ontology enrichment analysis	40139908	10.1093/gigascience/giaf021	2-s2.0-105001425999	2025-01-01
GNOme, an ontology for glycan naming and subsumption	39921684	10.1007/s00216-025-05757-8	2-s2.0-85217982914	2025-04-01
GTO: A comprehensive gene therapy omnibus	39540438	10.1093/nar/gkae1051	2-s2.0-85214660292	2025-01-06
HERB 2.0: An updated database integrating clinical and experimental evidence for traditional Chinese medicine	39558177	10.1093/nar/gkae1037	2-s2.0-85214444798	2025-01-06
Integrated Metabolomic and Transcriptomic Analysis Reveals the Pharmacological Effects and Differential Mechanisms of Isoflavone Biosynthesis in Four Species of Glycyrrhiza	40141180	10.3390/ijms26062539	2-s2.0-105000862638	2025-03-01
MIO: An ontology for annotating and integrating medical knowledge in myocardial infarction to enhance clinical decision making		10.1016/j.compbiomed.2025.110107	2-s2.0-105001474462	2025-05-01
MarkerDB 2.0: A comprehensive molecular biomarker database for 2025	39535054	10.1093/nar/gkae1056	2-s2.0-85214677529	2025-01-06
MedGraphNet: Leveraging Multi-Relational Graph Neural Networks and Text Knowledge for Biomedical Predictions			2-s2.0-85216933889	2024-01-01
MedKG: enabling drug discovery through a unified biomedical knowledge graph		10.1007/s11030-025-11164-z	2-s2.0-105000202559	2025-01-01
Petagraph: A large-scale unifying knowledge graph framework for integrating biomolecular and biomedical data	39695169	10.1038/s41597-024-04070-w	2-s2.0-85212405900	2024-12-01
SPEED++: A Multilingual Event Extraction Framework for Epidemic Prediction and Preparedness		10.18653/v1/2024.emnlp-main.720	2-s2.0-85217820359	2024-01-01
Standardized pipelines support and facilitate integration of diverse datasets at the Rat Genome Database	39841812	10.1093/database/baae132	2-s2.0-85216608239	2025-01-01
The PLSDB 2025 update: Enhanced annotations and improved functionality for comprehensive plasmid research	39565221	10.1093/nar/gkae1095	2-s2.0-85214434992	2025-01-06
The TOXIN knowledge graph: supporting animal-free risk assessment of cosmetics	39879562	10.1093/database/baae121	2-s2.0-85216871520	2025-01-01
Unlocking biological insights from differentially expressed genes: Concepts, methods, and future perspectives		10.1016/j.jare.2024.12.004	2-s2.0-85212320059	2024-01-01
Updates implemented in version 4 of the GlyCosmos Glycoscience Portal	39690313	10.1007/s00216-024-05692-0	2-s2.0-85212254444	2025-02-01
VarGuideAtlas: a repository of variant interpretation guidelines	40067792	10.1093/database/baaf017	2-s2.0-105000103121	2025-01-01
Ontology for Intelligent Disease Diagnosis		10.1109/ICELTICs62730.2024.10776498	2-s2.0-85214666306	2024-01-01
Exploring the predictive values of SERP4 and FRZB in dilated cardiomyopathy based on an integrated analysis.	39425025	10.1186/s12872-024-04255-6		2024-10-18
GPACDA – circRNA-Disease Association Prediction with Generating Polynomials		10.1007/978-3-031-64629-4_3	2-s2.0-85202609567	2024-01-01
A best-match approach for gene set analyses in embedding spaces	39231608	10.1101/gr.279141.124	2-s2.0-85206217051	2024-09-01
An ensemble approach for circular RNA-disease association prediction using variational autoencoder and genetic algorithm	39215523	10.1142/S0219720024500185	2-s2.0-85202826382	2024-08-01
Data-driven drug treatment: enhancing clinical decision-making with SalpPSO-optimized GraphSAGE		10.1080/10255842.2024.2399012	2-s2.0-85204381130	2024-01-01
Disease Models for Rare Genetic Disorders		10.1007/978-981-99-9323-9_4	2-s2.0-85205342334	2024-01-01
Merging Biomedical Ontologies with BioSTransformers	39176907	10.3233/SHTI240526	2-s2.0-85202005093	2024-08-22
SiMHOMer: Siamese Models for Health Ontologies Merging and Validation Through Large Language Models		10.1007/978-3-031-64629-4_9	2-s2.0-85202640943	2024-01-01
Using Generative Large Language Models for Hierarchical Relationship Prediction in Medical Ontologies		10.1109/ICHI61247.2024.00040	2-s2.0-85203690166	2024-01-01
Ontologies related to livestock for the Global Burden of Animal Diseases programme: a review	39222110	10.20506/rst.43.3519	2-s2.0-85203112352	2024-08-01
CHNSCDA: circRNA-disease association prediction based on strongly correlated heterogeneous neighbor sampling		10.1007/s13042-024-02375-1	2-s2.0-85204289290	2024-01-01
Biomedical Applications of Precision Medicine in Neurodegenerative Diseases		10.1007/978-3-319-75922-7_55	2-s2.0-85205463402	2023-01-01
IGF1 and CXCR4 Respectively Related with Inhibited M1 Macrophage Polarization in Keloids		10.1097/SCS.0000000000010479	2-s2.0-85202027213	2024-01-01
Enhancing Large Language Models with Human Expertise for Disease Detection in Electronic Health Records		10.1109/ICDH62654.2024.00031	2-s2.0-85203801521	2024-01-01
Knowledge Graphs in Information Retrieval		10.34190/eckm.25.1.2876	2-s2.0-85206638453	2024-01-01
STNMDA: A novel model for predicting potential microbe-drug associations with structure-aware transformer		10.2174/0115748936272939231212102627	2-s2.0-85205982152	2024-01-01
microRNA-324 mediates bone homeostasis and the regulation of osteoblast and osteoclast differentiation and activity	39383985	10.1016/j.bone.2024.117273	2-s2.0-85206075504	2025-01-01
A Comprehensive Review of the Data and Knowledge Graphs Approaches in Bioinformatics<sup>⋆</sup>		10.2298/CSIS230530027G	2-s2.0-85201692797	2024-06-01
Bioinformatics Identification and Validation of Angiogenesis-Related Genes in Myocardial Ischemic Reperfusion Injury		10.31083/j.fbl2910347	2-s2.0-85205797801	2024-10-01
Disease Similarity and Disease Clustering		10.1007/978-3-031-67871-4_5	2-s2.0-85202609573	2024-01-01
Gene annotation: Resources for the heart		10.1016/B978-0-12-822951-4.00022-9	2-s2.0-85202851813	2024-01-01
Genetically and semantically aware homogeneous network for prediction and scoring of comorbidities	39418770	10.1016/j.compbiomed.2024.109252	2-s2.0-85206193274	2024-12-01
Integrative Graph-Based Framework for Predicting circRNA Drug Resistance Using Disease Contextualization and Deep Learning		10.1109/JBHI.2024.3457271	2-s2.0-85203793003	2024-01-01
Review of Ontology Construction and Applications		10.16353/j.cnki.1000-7490.2023.11.024	2-s2.0-85190459087	2023-11-01
A framework for integrating biomedical knowledge in Wikidata with open biological and biomedical ontologies and MeSH keywords.	39403518	10.1016/j.heliyon.2024.e38448		2024-09-27
Alzheimer's Disease Knowledge Graph Enhances Knowledge Discovery and Disease Prediction.	39005357	10.1101/2024.07.03.601339		2024-07-05
CBGDA: a manually curated resource for gene-disease associations based on genome-wide CRISPR.	39213392	10.1093/database/baae077		2024-08-30
Disease coverage of human genome-wide association studies and pharmaceutical research and development.	39379679	10.1038/s43856-024-00625-5		2024-10-08
Dissecting the Reduced Penetrance of Putative Loss-of-Function Variants in Population-Scale Biobanks.	39399029	10.1101/2024.09.23.24314008		2024-10-07
Improving dictionary-based named entity recognition with deep learning.	39230709	10.1093/bioinformatics/btae402		2024-09-01
Incorporating Tissue-Specific Gene Expression Data to Improve Chemical-Disease Inference of in Silico Toxicogenomics Methods.	39189172	10.3390/jox14030057		2024-07-31
Insights into a Machine Learning-Based Palmitoylation-Related Gene Model for Predicting the Prognosis and Treatment Response of Breast Cancer Patients.	39205467	10.1177/15330338241263434		2024-01-01
Integrating cellular experiments, single-cell sequencing, and machine learning to identify endoplasmic reticulum stress biomarkers in idiopathic pulmonary fibrosis.	39340293	10.1080/07853890.2024.2409352		2024-12-01
Integration of chromosome locations and functional aspects of enhancers and topologically associating domains in knowledge graphs enables versatile queries about gene regulation.	38967009	10.1093/nar/gkae566		2024-08-27
LDAGM: prediction lncRNA-disease asociations by graph convolutional auto-encoder and multilayer perceptron based on multi-view heterogeneous networks.	39407120	10.1186/s12859-024-05950-z		2024-10-15
Modelling cell type-specific lncRNA regulatory network in autism with Cycle.	39333906	10.1186/s12859-024-05933-0		2024-09-27
Self-assembled thin films as alternative surface textures in assistive aids with users who are blind.	39264329	10.1039/d4tb01646g		2024-10-09
Talking about diseases; developing a model of patient and public-prioritised disease phenotypes.	39349692	10.1038/s41746-024-01257-8		2024-09-30
The Anti-Inflammatory Effect of Lactococcus lactis-Ling-Zhi 8 on Ameliorating Atherosclerosis and Nonalcoholic Fatty Liver in High-Fat Diet Rabbits.	39457059	10.3390/ijms252011278		2024-10-20
ToxDAR: A Workflow Software for Analyzing Toxicologically Relevant Proteomic and Transcriptomic Data, from Data Preparation to Toxicological Mechanism Elucidation.	39273492	10.3390/ijms25179544		2024-09-02
Zero-shot evaluation of ChatGPT for food named-entity recognition and linking.	39290564	10.3389/fnut.2024.1429259		2024-08-13
simona: a comprehensive R package for semantic similarity analysis on bio-ontologies.	39285315	10.1186/s12864-024-10759-4		2024-09-16
Large language models for medicine: a survey		10.1007/s13042-024-02318-w	2-s2.0-85201433727	2024-01-01
Spatially resolved epigenome sequencing via Tn5 transposition and deterministic DNA barcoding in tissue		10.1038/s41596-024-01013-y	2-s2.0-85197386983	2024-01-01
XAI-Based Clinical Decision Support Systems: A Systematic Review		10.3390/app14156638	2-s2.0-85200871198	2024-08-01
COVID-19 Vaccination in Pregnancy: Pilot Study of Plasma MicroRNAs Associated with Inflammatory Cytokines after COVID-19 mRNA Vaccination		10.3390/vaccines12060658	2-s2.0-85197120114	2024-06-01
Network Pharmacology Analysis of the Potential Pharmacological Mechanism of a Sleep Cocktail	38927034	10.3390/biom14060630	2-s2.0-85197169376	2024-06-01
Bridging the Knowledge Gap: Improving BERT models for answering MCQs by using Ontology-generated synthetic MCQA Dataset			2-s2.0-85198462719	2024-05-12
Using clusterProfiler to characterize multiomics data		10.1038/s41596-024-01020-z	2-s2.0-85198833681	2024-01-01
A Method for Inferring Candidate Disease-Disease Associations		10.1007/978-3-031-63772-8_8	2-s2.0-85199563898	2024-01-01
Sodium-glucose cotransporter 2 inhibitors induce anti-inflammatory and anti-ferroptotic shift in epicardial adipose tissue of subjects with severe heart failure	38943140	10.1186/s12933-024-02298-9	2-s2.0-85197112388	2024-12-01
Altered tumor microenvironment heterogeneity of penile cancer during progression from non-lymphatic to lymphatic metastasis	39003681	10.1002/cam4.70025	2-s2.0-85198656112	2024-07-01
Concept2Text: an explainable multilingual rewriting of concepts into natural language			2-s2.0-85200126703	2024-01-01
Large Language Model-Based Natural Language Encoding Could Be All You Need for Drug Biomedical Association Prediction		10.1021/acs.analchem.4c01793	2-s2.0-85198997774	2024-01-01
Empowering standardization of cancer vaccines through ontology: enhanced modeling and data analysis	38890666	10.1186/s13326-024-00312-3	2-s2.0-85196203883	2024-12-01
Classify Alzheimer genes association using Naïve Bayes algorithm		10.1016/j.humgen.2024.201309	2-s2.0-85196785987	2024-09-01
