title	pmid	doi	scopus_eid	pub_date
Cell Taxonomy: a curated repository of cell types with multifaceted characterization.	36161321	10.1093/nar/gkac816		2023-01-06
ChemFOnt: the chemical functional ontology resource.	36305829	10.1093/nar/gkac919		2023-01-06
CIViCdb 2022: evolution of an open-access cancer variant interpretation knowledgebase.	36373660	10.1093/nar/gkac979		2023-01-06
HGD: an integrated homologous gene database across multiple species.	36318261	10.1093/nar/gkac970		2023-01-06
LncTarD 2.0: an updated comprehensive database for experimentally-supported functional lncRNA-target regulations in human diseases.	36321659	10.1093/nar/gkac984		2023-01-06
MethBank 4.0: an updated database of DNA methylation across a variety of species.	36318250	10.1093/nar/gkac969		2023-01-06
MirDIP 5.2: tissue context annotation and novel microRNA curation.	36453996	10.1093/nar/gkac1070		2023-01-06
Pharos 2023: an integrated resource for the understudied human proteome.	36624666	10.1093/nar/gkac1033		2023-01-06
RNADisease v4.0: an updated resource of RNA-associated diseases, providing RNA-disease analysis, enrichment and prediction.	36134718	10.1093/nar/gkac814		2023-01-06
The Cancer Epitope Database and Analysis Resource (CEDAR).	36250634	10.1093/nar/gkac902		2023-01-06
C1QC, VSIG4, and CFD as Potential Peripheral Blood Biomarkers in Atrial Fibrillation-Related Cardioembolic Stroke.	36644582	10.1155/2023/5199810		2023-01-05
Single-cell-led drug repurposing for Alzheimer's disease.	36604493	10.1038/s41598-023-27420-x		2023-01-05
Knowledge-Driven Mechanistic Enrichment of the Preeclampsia Ignorome.	36540992			2023-01-01
PhenoExam: gene set analyses through integration of different phenotype databases.	36587217	10.1186/s12859-022-05122-x		2022-12-31
Comparative proteoinformatics revealed the essentials of SDS impact on HaCaT keratinocytes.	36509991	10.1038/s41598-022-25934-4		2022-12-12
Pharmacological Mechanism of NRICM101 for COVID-19 Treatments by Combined Network Pharmacology and Pharmacodynamics.	36499711	10.3390/ijms232315385		2022-12-06
Dissecting the molecular mechanism of cepharanthine against COVID-19, based on a network pharmacology strategy combined with RNA-sequencing analysis, molecular docking, and molecular dynamics simulation.	36403355	10.1016/j.compbiomed.2022.106298		2022-12-01
iSnoDi-LSGT: identifying snoRNA-disease associations based on local similarity constraints and global topological constraints.	36192132	10.1261/rna.079325.122		2022-12-01
A central role for STAT5 in the transcriptional programing of T helper cell metabolism.	36427325	10.1126/sciimmunol.abl9467		2022-11-25
e-TSN: an interactive visual exploration platform for target-disease knowledge mapping from literature.	36347537	10.1093/bib/bbac465		2022-11-19
EXPERT: transfer learning-enabled context-aware microbial community classification.	36124759	10.1093/bib/bbac396		2022-11-19
Integrated Chemical Characterization, Network Pharmacology and Transcriptomics to Explore the Mechanism of Sesquiterpenoids Isolated from Gynura divaricata (L.) DC. against Chronic Myelogenous Leukemia.	36422564	10.3390/ph15111435		2022-11-19
NT-proBNP and stem cell factor plasma concentrations are independently associated with cardiovascular outcomes in end-stage renal disease hemodialysis patients.	36600882	10.1093/ehjopen/oeac069		2022-11-09
DIO3 protects against thyrotoxicosis-derived cranio-encephalic and cardiac congenital abnormalities.	36166296	10.1172/jci.insight.161214		2022-11-08
Upregulation of matrix metalloproteinase 14 (MMP14) is associated with poor prognosis in renal clear cell carcinoma-a bioinformatics analysis.	36507474	10.21037/tau-22-619		2022-11-01
iPiDA-GCN: Identification of piRNA-disease associations based on Graph Convolutional Network.	36301998	10.1371/journal.pcbi.1010671		2022-10-27
The Pharmacorank Search Tool for the Retrieval of Prioritized Protein Drug Targets and Drug Repositioning Candidates According to Selected Diseases.	36358909	10.3390/biom12111559		2022-10-26
Ontology-driven weak supervision for clinical entity classification in electronic health records.	32793768			2020-08-05
The PRISM semantic cohort builder: a novel tool to search and access clinical data in TCIA imaging collections		10.1088/1361-6560/ac9d1d	2-s2.0-85145592478	2023-07-01
A latent semantic analysis method for ranking the results of human disease search engine		10.11591/eei.v12i2.4602	2-s2.0-85144024602	2023-04-01
Sparse regularized joint projection model for identifying associations of non-coding RNAs and human diseases		10.1016/j.knosys.2022.110044	2-s2.0-85141287830	2022-12-22
DxGenerator: An Improved Differential Diagnosis Generator for Primary Care Based on MetaMap and Semantic Reasoning	35858654	10.1055/a-1905-5639	2-s2.0-85144589823	2022-12-01
YMLA: A comparative platform to carry out functional enrichment analysis for multiple gene lists in yeast	36455295	10.1016/j.compbiomed.2022.106314	2-s2.0-85142900383	2022-12-01
MuCoMiD: A Multitask Graph Convolutional Learning Framework for miRNA-Disease Association Prediction		10.1109/TCBB.2022.3176456	2-s2.0-85130506199	2022-11-01
Exploring Epigenomic Datasets by ChIPseeker	36286622	10.1002/cpz1.585	2-s2.0-85140856830	2022-10-01
A machine learning framework based on multi-source feature fusion for circRNA-disease association prediction	36070867	10.1093/bib/bbac388	2-s2.0-85138491312	2022-09-01
An Overview of Drugs, Diseases, Genes and Proteins in the CORD-19 Corpus		10.26342/2022-69-14	2-s2.0-85140450220	2022-09-01
GraphCDA: a hybrid graph representation learning framework based on GCN and GAT for predicting disease-associated circRNAs	36070619	10.1093/bib/bbac379	2-s2.0-85138491978	2022-09-01
Retinal ganglion cell-specific genetic regulation in primary open-angle glaucoma		10.1016/j.xgen.2022.100142	2-s2.0-85134802161	2022-06-08
Deep learning methods for network biology		10.1142/9781800610941_0007	2-s2.0-85140726235	2022-01-17
Towards an ontology-based approach to enhance the mobile blood collection process		10.1016/j.procs.2022.09.341	2-s2.0-85143342880	2022-01-01
Mutual interactors as a principle for phenotype discovery in molecular interaction networks	36540965	10.1142/9789811270611_0007	2-s2.0-85144308569	2023-01-01
A systems biology approach towards oral cancer using computational tools and techniques		10.1016/j.chemolab.2022.104709	2-s2.0-85141793465	2022-12-15
Neural Natural Language Processing for unstructured data in electronic health records: A review		10.1016/j.cosrev.2022.100511	2-s2.0-85143077377	2022-11-01
RNMFLP: Predicting circRNA-disease associations based on robust nonnegative matrix factorization and label propagation	35534179	10.1093/bib/bbac155	2-s2.0-85138496532	2022-09-01
Recent advances in predicting lncRNA–disease associations based on computational methods	36370992	10.1016/j.drudis.2022.103432	2-s2.0-85142129349	2023-02-01
Data resources and computational methods for lncRNA-disease association prediction	36610216	10.1016/j.compbiomed.2022.106527	2-s2.0-85145782121	2023-02-01
Knowledge graph enrichment from clinical narratives using NLP, NER, and biomedical ontologies for healthcare applications		10.1007/s41870-022-01145-y	2-s2.0-85145502409	2023-01-01
Machine Learning-Friendly Biomedical Datasets for Equivalence and Subsumption Ontology Matching		10.1007/978-3-031-19433-7_33	2-s2.0-85141691092	2022-01-01
Ontoclick: a web browser extension to facilitate biomedical knowledge curation		10.1093/bioinformatics/btab520	2-s2.0-85143063110	2022-01-01
Towards an Intelligence system to support Diseases' Diagnoses and improve Health treatments		10.1109/DASC/PiCom/CBDCom/Cy55231.2022.9927988	2-s2.0-85145347705	2022-01-01
TIGA: target illumination GWAS analytics		10.1093/bioinformatics/btab427	2-s2.0-85123852548	2021-11-01
OncoPubMiner: a platform for mining oncology publications	36058206	10.1093/bib/bbac383	2-s2.0-85138496533	2022-09-01
Identification of hub biomarkers of myocardial infarction by single-cell sequencing, bioinformatics, and machine learning.	35958412	10.3389/fcvm.2022.939972		2022-07-25
Identification of immune hub genes participating in the pathogenesis and progression of Vogt-Koyanagi-Harada disease.	35958546	10.3389/fimmu.2022.936707		2022-07-25
Regulome-based characterization of drug activity across the human diseasome.	36344521	10.1038/s41540-022-00255-4		2022-11-07
[Rare-disease data standards].	36149471	10.1007/s00103-022-03591-2		2022-11-01
Graph representation learning in biomedicine and healthcare.	36316368	10.1038/s41551-022-00942-x		2022-10-31
Effective medical center finding during COVID-19 pandemic using a spatial DSS centered on ontology engineering.	36320661	10.1007/s10708-022-10777-3		2022-10-27
A comprehensive update on CIDO: the community-based coronavirus infectious disease ontology.	36271389	10.1186/s13326-022-00279-z		2022-10-21
A network-based approach for isolating the chronic inflammation gene signatures underlying complex diseases towards finding new treatment opportunities.	36313344	10.3389/fphar.2022.995459		2022-10-12
Assessment of DDAH1 and DDAH2 Contributions to Psychiatric Disorders via In Silico Methods.	36233204	10.3390/ijms231911902		2022-10-07
<i>Caulis Polygoni Multiflori</i> Accelerates Megakaryopoiesis and Thrombopoiesis via Activating PI3K/Akt and MEK/ERK Signaling Pathways.	36297316	10.3390/ph15101204		2022-09-28
Survival-based bioinformatics analysis to identify hub long non-coding RNAs along with lncRNA-miRNA-mRNA network for potential diagnosis/prognosis of thyroid cancer.	36149574	10.1007/s12079-022-00697-9		2022-09-23
Assessing equivalent and inverse change in genes between diverse experiments.	36304274	10.3389/fbinf.2022.893032		2022-09-21
Modeling and integration of N-glycan biomarkers in a comprehensive biomarker data model.	35925813	10.1093/glycob/cwac046		2022-09-19
Signatures of Co-Deregulated Genes and Their Transcriptional Regulators in Lung Cancer.	36142846	10.3390/ijms231810933		2022-09-18
Identification of the Diagnostic Biomarker VIPR1 in Hepatocellular Carcinoma Based on Machine Learning Algorithm.	36157238	10.1155/2022/2469592		2022-09-15
H19 may regulate the immune cell infiltration in carcinogenesis of gastric cancer through miR-378a-5p/SERPINH1 signaling.	36104825	10.1186/s12957-022-02760-6		2022-09-14
Integrating and formatting biomedical data as pre-calculated knowledge graph embeddings in the Bioteque.	36085310	10.1038/s41467-022-33026-0		2022-09-09
The Representation of Causality and Causation with Ontologies: A Systematic Literature Review.	36120162	10.5210/ojphi.v14i1.12577		2022-09-07
Inferring human miRNA-disease associations via multiple kernel fusion on GCNII.	36134032	10.3389/fgene.2022.980497		2022-09-05
Organization of gene programs revealed by unsupervised analysis of diverse gene-trait associations.	35716123	10.1093/nar/gkac413		2022-08-26
LeMeDISCO is a computational method for large-scale prediction; molecular interpretation of disease comorbidity.	36008469	10.1038/s42003-022-03816-9		2022-08-25
iPiDA-LTR: Identifying piwi-interacting RNA-disease associations based on Learning to Rank.	35969645	10.1371/journal.pcbi.1010404		2022-08-15
CCAS: One-stop and comprehensive annotation system for individual cancer genome at multi-omics level.	36035123	10.3389/fgene.2022.956781		2022-08-11
Circulating microRNA signatures associated with disease severity and outcome in COVID-19 patients.	36032130	10.3389/fimmu.2022.968991		2022-08-11
Ten quick tips for biomarker discovery and validation analyses using machine learning.	35951526	10.1371/journal.pcbi.1010357		2022-08-11
A survey of genome-wide association studies, polygenic scores and UK Biobank highlights resources for autoimmune disease genetics.	35990650	10.3389/fimmu.2022.972107		2022-08-05
Identification and characterization of four immune-related signatures in keloid.	35967426	10.3389/fimmu.2022.942446		2022-07-27
Contribution of model organism phenotypes to the computational identification of human disease genes.	35758016	10.1242/dmm.049441		2022-07-01
The third international hackathon for applying insights into large-scale genomic composition to use cases in a wide range of organisms.	36262335	10.12688/f1000research.110194.1		2022-05-16
Gene Ontology: application and importance in functional annotation of the genomic data		10.1016/B978-0-323-89775-4.00015-8	2-s2.0-85139302224	2021-01-01
Support vector machine based disease classification model employing hasten eagle Cuculidae search optimization		10.1002/cpe.7259	2-s2.0-85136530394	2022-11-15
Ontology-based categorization of clinical studies by their conditions	36283581	10.1016/j.jbi.2022.104235	2-s2.0-85140925219	2022-11-01
Transcriptome and DNA methylome analyses reveal underlying mechanisms for the racial disparity in uterine fibroids	36066972	10.1172/jci.insight.160274	2-s2.0-85140418022	2022-10-24
Biomedical Relation Extraction With Knowledge Graph-Based Recommendations	35536818	10.1109/JBHI.2022.3173558	2-s2.0-85132523504	2022-08-01
ConSIG: Consistent discovery of molecular signature from OMIC data	35758241	10.1093/bib/bbac253	2-s2.0-85134720455	2022-07-01
A Semantic Framework Supporting Multilayer Networks Analysis for Rare Diseases		10.4018/IJSWIS.297141	2-s2.0-85133127602	2022-01-01
Graph Convolutional Auto-Encoders for Predicting Novel lncRNA-Disease Associations	33819159	10.1109/TCBB.2021.3070910	2-s2.0-85103890921	2022-01-01
In Silico Databases and Tools for Drug Repurposing		10.1016/B978-0-12-816125-8.00024-9	2-s2.0-85137861293	2019-01-01
Adding structured information to the ANVISA’s “Bulário Eletrônico”			2-s2.0-85135286745	2015-01-01
idenMD-NRF: A ranking framework for miRNA-disease association identification	35679537	10.1093/bib/bbac224	2-s2.0-85134636046	2022-07-01
A comprehensive decision support model for online doctors ranking with interval-valued neutrosophic numbers		10.1111/itor.13208	2-s2.0-85137565918	2022-01-01
DeepIDA: Predicting Isoform-Disease Associations by Data Fusion and Deep Neural Networks	33571094	10.1109/TCBB.2021.3058801	2-s2.0-85101488457	2022-01-01
Overcoming Sparseness of Biomedical Networks to Identify Drug Repositioning Candidates	33591920	10.1109/TCBB.2021.3059807	2-s2.0-85101288709	2022-01-01
Bidirectional spreading activation method for finding human diseases relatedness using well formed disease ontology		10.4018/978-1-7998-1204-3.ch090	2-s2.0-85137555437	2019-12-06
Biomedical ontologies and their development, management, and applications in and beyond China		10.1097/JBR.0000000000000051	2-s2.0-85113395977	2019-01-01
Rule Based Medicine Recommendation for Skin Diseases Using Ontology with Semantic Information		10.1007/978-3-031-12638-3_31	2-s2.0-85135898427	2022-01-01
Identification of Biomarkers in Intracranial Aneurysm and Their Immune Infiltration Characteristics	35798291	10.1016/j.wneu.2022.06.138	2-s2.0-85135348017	2022-10-01
Using FlyBase: A Database of Drosophila Genes and Genetics	35980571	10.1007/978-1-0716-2541-5_1	2-s2.0-85136639786	2022-01-01
A Novel Tightly Coupled Information System for Research Data Management		10.3390/electronics11193196	2-s2.0-85139868482	2022-10-01
Paving the way for enriched metadata of linguistic linked data		10.3233/SW-222994	2-s2.0-85140839697	2022-08-29
Online in silico validation of disease and gene sets, clusterings or subnetworks with DIGEST	35753693	10.1093/bib/bbac247	2-s2.0-85134721065	2022-07-01
Artificial Intelligence in Bioinformatics: From Omics Analysis to Deep Learning and Network Mining		10.1016/C2019-0-04920-5	2-s2.0-85138931915	2022-01-01
CARING for xAI			2-s2.0-85138226596	2022-01-01
Fine-Grained ICD Code Assignment Using Ontology-Based Classification		10.1109/IRI54793.2022.00058	2-s2.0-85139018761	2022-01-01
The Leipzig Health Atlas-An open platform to present, archive and share bio-medical data, analyses and models online		10.1055/a-1914-1985	2-s2.0-85136156537	2022-01-01
A Review: Biological Insights on Knowledge Graphs		10.1007/978-3-031-15743-1_36	2-s2.0-85137987064	2022-01-01
A community approach to the cancer-variant-interpretation bottleneck.	35624339	10.1038/s43018-022-00379-w		2022-05-01
Human Health Exposure Analysis Resource (HHEAR): A model for incorporating the exposome into health studies.	34034040	10.1016/j.ijheh.2021.113768		2021-06-01
The Children's Health Exposure Analysis Resource: enabling research into the environmental influences on children's health outcomes.	28383342	10.1097/MOP.0000000000000491		2017-06-01
Identification of miRNA–disease associations via deep forest ensemble learning based on autoencoder	35325038	10.1093/bib/bbac104	2-s2.0-85130766184	2022-05-01
Review on predicting pairwise relationships between human microbes, drugs and diseases: from biological data to computational models	35325024	10.1093/bib/bbac080	2-s2.0-85130355161	2022-05-01
A Network-Based Analysis of Disease Modules from a Taxonomic Perspective	34428165	10.1109/JBHI.2021.3106787	2-s2.0-85128489347	2022-04-01
Digital Humanities and Portuguese Processing: a research pathway			2-s2.0-85129204256	2022-01-01
Integrated Transcriptomics and Reverse Pharmacophore Mapping-based Network Pharmacology to Explore the Mechanisms of Natural Compounds against Doxorubicin-induced Cardiotoxicity	34397328	10.2174/1386207324666210816122629	2-s2.0-85135242548	2022-01-01
Survey of Various Statistical Numerical and Machine Learning Ontological Models on Infectious Disease Ontology		10.1002/9781119785620.ch17	2-s2.0-85131172660	2021-01-01
iLncDA-LTR: Identification of lncRNA-disease associations by learning to rank	35594681	10.1016/j.compbiomed.2022.105605	2-s2.0-85130325784	2022-07-01
Analysis of Causal Relationships in Integrated Ontologies of Diseases, Phenotypes, and Radiological Diagnosis	35673013	10.3233/SHTI220074	2-s2.0-85131504249	2022-06-06
Applying Transformer Models for Disease Named Entity Recognition		10.1109/ICARC54489.2022.9754023	2-s2.0-85128916847	2022-01-01
Evaluating and extending the Informed Consent Ontology for representing permissions from the clinical domain		10.3233/AO-210260	2-s2.0-85130367681	2022-01-01
iCircDA-LTR: identification of circRNA-disease associations based on Learning to Rank		10.1093/bioinformatics/btab334	2-s2.0-85119015623	2021-10-01
Ontology Driven Cross-Linked Domain Data Integration and Spatial Semantic Multi Criteria Query System for Geospatial Public Health		10.4018/978-1-5225-8054-6.ch032	2-s2.0-85129038433	2019-01-01
Transcriptome meta-analysis of valproic acid exposure in human embryonic stem cells	35635998	10.1016/j.euroneuro.2022.04.008	2-s2.0-85131051182	2022-07-01
MDADP: A Webserver Integrating Database and Prediction Tools for Microbe-Disease Associations	35254998	10.1109/JBHI.2022.3156166	2-s2.0-85126325796	2022-07-01
Research on LncRNA and Disease Associations Prediction Base on Data Mining		10.1088/1742-6596/2219/1/012029	2-s2.0-85130508715	2022-05-06
Automated intelligent online healthcare ontology Integration		10.1109/ICCI54321.2022.9756070	2-s2.0-85129395870	2022-01-01
The Organ-Disease Annotations (ODiseA) Database of Hereditary Diseases and Inflicted Tissues	35504357	10.1016/j.jmb.2022.167619	2-s2.0-85130310784	2022-06-15
SeEn: Sequential enriched datasets for sequence-aware recommendations.	35927282	10.1038/s41597-022-01598-7		2022-08-04
PheNominal: an EHR-integrated web application for structured deep phenotyping at the point of care.	35902925	10.1186/s12911-022-01927-1		2022-07-28
Transcriptomic and proteomic retinal pigment epithelium signatures of age-related macular degeneration.	35882847	10.1038/s41467-022-31707-4		2022-07-26
DES-Amyloidoses ""Amyloidoses through the looking-glass"": A knowledgebase developed for exploring and linking information related to human amyloid-related diseases.	35877764	10.1371/journal.pone.0271737		2022-07-25
Follistatin-like 1 and its paralogs in heart development and cardiovascular disease.	35867287	10.1007/s10741-022-10262-6		2022-07-22
An Urban Population Health Observatory for Disease Causal Pathway Analysis and Decision Support: Underlying Explainable Artificial Intelligence Model.	35857363	10.2196/36055		2022-07-20
Characterizing and explaining the impact of disease-associated mutations in proteins without known structures or structural homologs.	35641150	10.1093/bib/bbac187		2022-07-18
The Core Human Microbiome: Does It Exist and How Can We Find It? A Critical Review of the Concept.	35889831	10.3390/nu14142872		2022-07-13
The heterogeneous pharmacological medical biochemical network PharMeBINet.	35821017	10.1038/s41597-022-01510-3		2022-07-11
An Integrated Bioinformatics Analysis towards the Identification of Diagnostic, Prognostic, and Predictive Key Biomarkers for Urinary Bladder Cancer.	35884419	10.3390/cancers14143358		2022-07-10
Virofree, an Herbal Medicine-Based Formula, Interrupts the Viral Infection of Delta and Omicron Variants of SARS-CoV-2.	35860023	10.3389/fphar.2022.905197		2022-07-04
Prediction of circRNA-Disease Associations Based on the Combination of Multi-Head Graph Attention Network and Graph Convolutional Network.	35883487	10.3390/biom12070932		2022-07-02
Whole-genome sequencing reveals host factors underlying critical COVID-19.	35255492	10.1038/s41586-022-04576-6		2022-07-01
Common genetic variation associated with Mendelian disease severity revealed through cryptic phenotype analysis.	35760791	10.1038/s41467-022-31030-y		2022-06-27
From drug repositioning to target repositioning: prediction of therapeutic targets using genetically perturbed transcriptomic signatures.	35758779	10.1093/bioinformatics/btac240		2022-06-24
Omics-based integrated analysis identified IKZF2 as a biomarker associated with lupus nephritis.	35688845	10.1038/s41598-022-13336-5		2022-06-10
HemI 2.0: an online service for heatmap illustration.	35670661	10.1093/nar/gkac480		2022-06-07
GeMI: interactive interface for transformer-based Genomic Metadata Integration.	35657113	10.1093/database/baac036		2022-06-03
AnthraxKP: a knowledge graph-based, Anthrax Knowledge Portal mined from biomedical literature.	35653350	10.1093/database/baac037		2022-06-02
Expediting knowledge acquisition by a web framework for Knowledge Graph Exploration and Visualization (KGEV): case studies on COVID-19 and Human Phenotype Ontology.	35655307	10.1186/s12911-022-01848-z		2022-06-02
Diagnostic genes and immune infiltration analysis of colorectal cancer determined by LASSO and SVM machine learning methods: a bioinformatics analysis.	35837194	10.21037/jgo-22-536		2022-06-01
A Simple Standard for Sharing Ontological Mappings (SSSOM).	35616100	10.1093/database/baac035		2022-05-25
MAGCNSE: predicting lncRNA-disease associations using multi-view attention graph convolutional network and stacking ensemble model.	35590258	10.1186/s12859-022-04715-w		2022-05-19
GenePlexus: a web-server for gene discovery using network-based machine learning.	35580053	10.1093/nar/gkac335		2022-05-17
A molecular view of amyotrophic lateral sclerosis through the lens of interaction network modules.	35576218	10.1371/journal.pone.0268159		2022-05-16
Design and application of a knowledge network for automatic prioritization of drug mechanisms.	35561182	10.1093/bioinformatics/btac205		2022-05-13
DisPhaseDB: An integrative database of diseases related variations in liquid-liquid phase separation proteins.	35685370	10.1016/j.csbj.2022.05.004		2022-05-12
Drug Repositioning with GraphSAGE and Clustering Constraints Based on Drug and Disease Networks.	35620297	10.3389/fphar.2022.872785		2022-05-10
BioTAGME: A Comprehensive Platform for Biological Knowledge Network Analysis.	35571058	10.3389/fgene.2022.855739		2022-04-28
Transcriptome Analysis of Monocytes and Fibroblasts Provides Insights Into the Molecular Features of Periodontal Ehlers-Danlos Syndrome.	35571048	10.3389/fgene.2022.834928		2022-04-28
Inferring Potential Cancer Driving Synonymous Variants.	35627162	10.3390/genes13050778		2022-04-27
A Community-Driven, Openly Accessible Molecular Pathway Integrating Knowledge on Malignant Pleural Mesothelioma.	35558518	10.3389/fonc.2022.849640		2022-04-26
A Hybrid Protocol for Finding Novel Gene Targets for Various Diseases Using Microarray Expression Data Analysis and Text Mining.	35713858	10.1007/978-1-0716-2305-3_3		2022-01-01
Screening of Genes Related to Breast Cancer Prognosis Based on the DO-UniBIC Method.	35472336	10.1016/j.amjms.2022.04.022		2022-04-23
Comparison of Word and Character Level Information for Medical Term Identification Using Convolutional Neural Networks and Transformers.	34920520	10.3233/SHTI210717		2021-12-15
Development and use of Ontologies Inside the Neuroscience Information Framework: A Practical Approach.	22737162	10.3389/fgene.2012.00111		2012-06-22
CoMent: Relationships Between Biomedical Concepts Inferred From the Scientific Literature		10.1016/j.jmb.2022.167568	2-s2.0-85127794319	2022-01-01
Disease category-specific annotation of variants using an ensemble learning framework	34643213	10.1093/bib/bbab438	2-s2.0-85123813861	2022-01-01
PSINDB: The postsynaptic protein-protein interaction database	35234850	10.1093/database/baac007	2-s2.0-85125594887	2022-01-01
Ontology-based teacher-context data integration		10.1109/SII52469.2022.9708601	2-s2.0-85126241468	2022-01-01
Biomedical data, computational methods and tools for evaluating disease-disease associations	35136949	10.1093/bib/bbac006	2-s2.0-85127560929	2022-03-01
Clarithromycin-Amlodipine Interaction-induced Renal Injury: An In Silico Study			2-s2.0-85128768070	2022-01-01
Development and Applications of Interoperable Biomedical Ontologies for Integrative Data and Knowledge Representation and Multiscale Modeling in Systems Medicine	35437726	10.1007/978-1-0716-2265-0_12	2-s2.0-85128554947	2022-01-01
Graph representation learning in bioinformatics: Trends, methods and applications	34471921	10.1093/bib/bbab340	2-s2.0-85123813672	2022-01-01
