title	pmid	doi	scopus_eid	pub_date
Lantern: an integrative repository of functional annotations for lncRNAs in the human genome.	34039271	10.1186/s12859-021-04207-3		2021-05-26
Drug Repurposing for the Treatment of COVID-19: A Knowledge Graph Approach.	34179346	10.1002/adtp.202100055		2021-05-20
Increased hippocampal excitability in miR-324-null mice.	34001919	10.1038/s41598-021-89874-1		2021-05-17
Mapping OMIM Disease-Related Variations on Protein Domains Reveals an Association Among Variation Type, Pfam Models, and Disease Classes.	34026820	10.3389/fmolb.2021.617016		2021-05-07
Osteocyte transcriptome mapping identifies a molecular landscape controlling skeletal homeostasis and susceptibility to skeletal disease.	33953184	10.1038/s41467-021-22517-1		2021-05-05
A survey on predicting microbe-disease associations: Biological data and computational methods	34020541	10.1093/bib/bbaa157	2-s2.0-85106752233	2021-05-01
ILDMSF: Inferring Associations between Long Non-Coding RNA and Disease Based on Multi-Similarity Fusion	31443046	10.1109/TCBB.2019.2936476	2-s2.0-85107482845	2021-05-01
The VRNetzer platform enables interactive network analysis in Virtual Reality.	33893283	10.1038/s41467-021-22570-w		2021-04-23
A representation model for biological entities by fusing structured axioms with unstructured texts	33107905	10.1093/bioinformatics/btaa913	2-s2.0-85107091485	2021-04-15
Dietary Habit Is Associated with Depression and Intelligence: An Observational and Genome-Wide Environmental Interaction Analysis in the UK Biobank Cohort.	33807197	10.3390/nu13041150		2021-03-31
Abnormal upregulation of cardiovascular disease biomarker PLA2G7 induced by proinflammatory macrophages in COVID-19 patients.	33762651	10.1038/s41598-021-85848-5		2021-03-24
A review on viral data sources and search systems for perspective mitigation of COVID-19.	33348368	10.1093/bib/bbaa359		2021-03-22
A representation learning model based on variational inference and graph autoencoder for predicting lncRNA-disease associations.	33745450	10.1186/s12859-021-04073-z		2021-03-21
Pathway analysis for genome-wide genetic variation data: Analytic principles, latest developments, and new opportunities.	33896739	10.1016/j.jgg.2021.01.007		2021-03-20
Identification of disease treatment mechanisms through the multiscale interactome.	33741907	10.1038/s41467-021-21770-8		2021-03-19
Approaches to Identify and Characterise the Post-Transcriptional Roles of lncRNAs in Cancer.	33803328	10.3390/ncrna7010019		2021-03-09
Biomedical data and computational models for drug repositioning: A comprehensive review	32043521	10.1093/bib/bbz176	2-s2.0-85103474542	2021-03-01
Relation Prediction of Co-Morbid Diseases Using Knowledge Graph Completion	31295118	10.1109/TCBB.2019.2927310	2-s2.0-85104047643	2021-03-01
Simulation of psychological course satisfaction based on android mobile system and neural network		10.1016/j.micpro.2020.103751	2-s2.0-85098650593	2021-03-01
Hybrid semantic recommender system for chemical compounds in large-scale datasets.	33622374	10.1186/s13321-021-00495-2		2021-02-23
The similarity of inherited diseases (I): clinical similarity within the phenotypic series.	33622316	10.1186/s12920-021-00900-7		2021-02-23
Curation of over 10 000 transcriptomic studies to enable data reuse.	33599246	10.1093/database/baab006		2021-02-18
New Associations between Drug-Induced Adverse Events in Animal Models and Humans Reveal Novel Candidate Safety Targets	33338378	10.1021/acs.chemrestox.0c00311	2-s2.0-85098778273	2021-02-15
FlyBase: updates to the Drosophila melanogaster knowledge base.	33219682	10.1093/nar/gkaa1026		2021-01-08
MNDR v3.0: mammal ncRNA-disease repository with increased coverage and annotation.	32833025	10.1093/nar/gkaa707		2021-01-08
Mouse Genome Database (MGD): Knowledgebase for mouse-human comparative biology.	33231642	10.1093/nar/gkaa1083		2021-01-08
PK-DB: pharmacokinetics database for individualized and stratified computational modeling.	33151297	10.1093/nar/gkaa990		2021-01-08
The mouse Gene Expression Database (GXD): 2021 update.	33104772	10.1093/nar/gkaa914		2021-01-08
A constrained probabilistic matrix decomposition method for predicting miRNA-disease associations		10.2174/1574893615999200801014239	2-s2.0-85115861564	2021-01-01
An Ontology-Independent Representation Learning for Similar Disease Detection Based on Multi-Layer Similarity Network	31536013	10.1109/TCBB.2019.2941475	2-s2.0-85100619876	2021-01-01
An overview of biomedical ontologies for pandemics and infectious diseases representation		10.1016/j.procs.2021.09.201	2-s2.0-85116896668	2021-01-01
Association predictions of genomics, proteinomics, transcriptomics, microbiome, metabolomics, pathomics, radiomics, drug, symptoms, environment factor, and disease networks: A comprehensive approach		10.1002/med.21847	2-s2.0-85111750733	2021-01-01
CCOnto: The Character Computing Ontology		10.1007/978-3-030-75018-3_21	2-s2.0-85111102638	2021-01-01
Clarithromycin interactions with palbociclib (Cdk4/6 inhibitor)			2-s2.0-85110181479	2021-01-01
Conservation of copy number profiles during engraftment and passaging of patient-derived cancer xenografts.	33414553	10.1038/s41588-020-00750-6		2021-01-01
ILncRNAdis-FB: Identify lncRNA-Disease Associations by Fusing Biological Feature Blocks through Deep Neural Network	31905146	10.1109/TCBB.2020.2964221	2-s2.0-85089590723	2021-01-01
Interaction outcomes of carbamazepine-olanzapine combination used for psychotic disorder: An in silico study			2-s2.0-85107683823	2021-01-01
Krlsmda: Identifying human mirna–disease association based on similarity and kronecker regularized least squares method		10.3844/ajbbsp.2021.76.84	2-s2.0-85103235983	2021-01-01
miRSM: an R package to infer and analyse miRNA sponge modules in heterogeneous data		10.1080/15476286.2021.1905341	2-s2.0-85103904490	2021-01-01
Obo foundry food ontology interconnectivity			2-s2.0-85117007928	2021-01-01
ROC: An ontology for country responses towards COVID-19			2-s2.0-85103272238	2021-01-01
Time to infer miRNA sponge modules		10.1002/wrna.1686	2-s2.0-85111818004	2021-01-01
MISSION: Multimodal-Information-Aided Similar Disease Detection Based on Disease Information Network		10.1109/BIBM49941.2020.9313407	2-s2.0-85100348622	2020-12-16
Network-based gene prediction for TCM symptoms		10.1109/BIBM49941.2020.9313152	2-s2.0-85100354457	2020-12-16
Improving circRNA-disease association prediction by sequence and ontology representations with convolutional and recurrent neural networks		10.1093/bioinformatics/btaa1077	2-s2.0-85105026407	2020-12-15
A novel approach to identify subtype-specific network biomarkers of breast cancer survivability		10.1007/s13721-020-00249-4	2-s2.0-85086747203	2020-12-01
CircRNA-disease associations prediction based on metapath2vec++ and matrix factorization		10.26599/BDMA.2020.9020025	2-s2.0-85096453581	2020-12-01
Automatic Question Generation in Education Domain Based on Ontology		10.1109/CENIM51130.2020.9297991	2-s2.0-85099642210	2020-11-17
Toward Preparing a Knowledge Base to Explore Potential Drugs and Biomedical Entities Related to COVID-19: Automated Computational Approach.	33055059	10.2196/21648		2020-11-10
A network medicine approach to investigation and population-based validation of disease manifestations and drug repurposing for COVID-19.	33156843	10.1371/journal.pbio.3000970		2020-11-06
Decipher the connections between proteins and phenotypes	32707349	10.1016/j.bbapap.2020.140503	2-s2.0-85088372838	2020-11-01
HKGB: An Inclusive, Extensible, Intelligent, Semi-auto-constructed Knowledge Graph Framework for Healthcare with Clinicians’ Expertise Incorporated		10.1016/j.ipm.2020.102324	2-s2.0-85086676453	2020-11-01
Modelling kidney disease using ontology: insights from the Kidney Precision Medicine Project.	32939051	10.1038/s41581-020-00335-w		2020-11-01
Preclinical validation of therapeutic targets predicted by tensor factorization on heterogeneous graphs.	33106501	10.1038/s41598-020-74922-z		2020-10-26
iPiDA-sHN: Identification of Piwi-interacting RNA-disease associations by selecting high quality negative samples	32916452	10.1016/j.compbiolchem.2020.107361	2-s2.0-85090336101	2020-10-01
Relational completion based non-negative matrix factorization for predicting metabolite-disease associations		10.1016/j.knosys.2020.106238	2-s2.0-85087922377	2020-09-27
Prioritizing CircRNA-Disease Associations With Convolutional Neural Network Based on Multiple Similarity Feature Fusion.	33193615	10.3389/fgene.2020.540751		2020-09-16
Ontological approach to the knowledge systematization of a toxic process and toxic course representation framework for early drug risk management.	32883995	10.1038/s41598-020-71370-7		2020-09-03
Downregulation of miR‑193a‑3p via targeting cyclin D1 in thyroid cancer.	32705210	10.3892/mmr.2020.11310		2020-09-01
Knowledge Detection and Discovery using Semantic Graph Embeddings on Large Knowledge Graphs generated on Text Mining Results		10.15439/2020F36	2-s2.0-85095789650	2020-09-01
Mining the sociome for Health Informatics: Analysis of therapeutic lifestyle adherence of diabetic patients in Twitter		10.1016/j.future.2020.04.025	2-s2.0-85083653084	2020-09-01
Network control principles for identifying personalized driver genes in cancer	31711128	10.1093/bib/bbz089	2-s2.0-85091806658	2020-09-01
ReDU: a framework to find and reanalyze public mass spectrometry data.	32807955	10.1038/s41592-020-0916-7		2020-09-01
Knowledge-Based Decision Support in Healthcare via Near Field Communication.	32878204	10.3390/s20174923		2020-08-31
Computational Methods and Software Tools for Functional Analysis of miRNA Data.	32872205	10.3390/biom10091252		2020-08-28
Complement C7 (C7), a Potential Tumor Suppressor, Is an Immune-Related Prognostic Biomarker in Prostate Cancer (PC).	32984006	10.3389/fonc.2020.01532		2020-08-25
Sex differences in circulating proteins in heart failure with preserved ejection fraction.	32831121	10.1186/s13293-020-00322-7		2020-08-24
Biomedical Holistic Ontology for People with Rare Diseases.	32825147	10.3390/ijerph17176038		2020-08-19
OncoPDSS: an evidence-based clinical decision support system for oncology pharmacotherapy at the individual level.	32770988	10.1186/s12885-020-07221-5		2020-08-08
Extracellular proteostasis prevents aggregation during pathogenic attack.	32641833	10.1038/s41586-020-2461-z		2020-08-01
RNA-sequencing and bioinformatics analysis of long noncoding RNAs and mRNAs in the asthenozoospermia.	32614449	10.1042/BSR20194041		2020-07-31
Signatures of co-deregulated genes and their transcriptional regulators in colorectal cancer.	32737302	10.1038/s41540-020-00144-8		2020-07-31
Ontological Organization and Bioinformatic Analysis of Adverse Drug Reactions From Package Inserts: Development and Usability Study.	32706718	10.2196/20443		2020-07-20
Identification of potential crucial genes in atrial fibrillation: a bioinformatic analysis.	32682418	10.1186/s12920-020-00754-5		2020-07-18
Accessing the impact of functional variants on human phenotypes by transcriptome analysis in individuals carrying different rSNP alleles		10.1109/CSGB51356.2020.9214706	2-s2.0-85094827289	2020-07-01
Integrated network analysis of symptom clusters across disease conditions	32535270	10.1016/j.jbi.2020.103482	2-s2.0-85086727426	2020-07-01
ncRPheno: a comprehensive database platform for identification and validation of disease related noncoding RNAs.	32122231	10.1080/15476286.2020.1737441		2020-07-01
Network-based characterization of disease-disease relationships in terms of drugs and therapeutic targets.	32657408	10.1093/bioinformatics/btaa439		2020-07-01
COVID-19 pandemic reveals the peril of ignoring metadata standards.	32561801	10.1038/s41597-020-0524-5		2020-06-19
CIDO, a community-based ontology for coronavirus disease knowledge and data integration, sharing, and analysis.	32533075	10.1038/s41597-020-0523-6		2020-06-12
PMO: A knowledge representation model towards precision medicine	32987570	10.3934/MBE.2020227	2-s2.0-85092047724	2020-06-08
GlyGen data model and processing workflow.	32324859	10.1093/bioinformatics/btaa238		2020-06-01
RNA Sequencing Analyses Reveal the Potential Mechanism of Pulmonary Injury Induced by Gallium Arsenide Particles in Human Bronchial Epithelioid Cells.	32457348	10.1038/s41598-020-65518-8		2020-05-26
100 Years of evolving gene-disease complexities and scientific debutants	30972412	10.1093/bib/bbz038	2-s2.0-85084916005	2020-05-21
Comparison and integration of computational methods for deleterious synonymous mutation prediction	31157880	10.1093/bib/bbz047	2-s2.0-85084917441	2020-05-21
The IUPHAR Guide to Immunopharmacology: connecting immunology and pharmacology.	32020584	10.1111/imm.13175		2020-05-01
A harmonized meta-knowledgebase of clinical interpretations of somatic genomic variants in cancer.	32246132	10.1038/s41588-020-0603-8		2020-04-01
MosaicBase: A Knowledgebase of Postzygotic Mosaic Variants in Noncancer Disease-related and Healthy Human Individuals.	32911083	10.1016/j.gpb.2020.05.002		2020-04-01
A random forest based computational model for predicting novel lncRNA-disease associations.	32216744	10.1186/s12859-020-3458-1		2020-03-27
DES-ROD: Exploring Literature to Develop New Links between RNA Oxidation and Human Diseases.	32308806	10.1155/2020/5904315		2020-03-27
AllEnricher: a comprehensive gene set function enrichment tool for both model and non-model species.	32183716	10.1186/s12859-020-3408-y		2020-03-17
Wikidata as a knowledge graph for the life sciences.	32180547	10.7554/eLife.52614		2020-03-17
Temporal changes in the gene expression heterogeneity during brain development and aging.	32139741	10.1038/s41598-020-60998-0		2020-03-05
Skewed X-Chromosome Inactivation and Compensatory Upregulation of Escape Genes Precludes Major Clinical Symptoms in a Female With a Large Xq Deletion.	32194616	10.3389/fgene.2020.00101		2020-03-04
Mechanisms of tissue and cell-type specificity in heritable traits and diseases.	31913361	10.1038/s41576-019-0200-9		2020-03-01
OncoMX: A Knowledgebase for Exploring Cancer Biomarkers in the Context of Related Cancer and Healthy Data.	32142370	10.1200/CCI.19.00117		2020-03-01
Enhanced clinical phenotyping by mechanistic bioprofiling in heart failure with preserved ejection fraction: insights from the MEDIA-DHF study (The Metabolic Road to Diastolic Heart Failure)	32063068	10.1080/1354750X.2020.1727015	2-s2.0-85079733476	2020-02-17
Leveraging complementary computational models for prioritizing chemicals of developmental and reproductive toxicity concern: an example of food contact materials.	31897520	10.1007/s00204-019-02641-0		2020-02-01
Matching whole genomes to rare genetic disorders: Identification of potential causative variants using phenotype-weighted knowledge in the CAGI SickKids5 clinical genomes challenge.	31680375	10.1002/humu.23933		2020-02-01
Ontology-driven integrative analysis of omics data through Onassis.	31959844	10.1038/s41598-020-57716-1		2020-01-20
Predicting lncRNA-disease Association based on Extreme Gradient Boosting		10.1145/3386052.3386056	2-s2.0-85089139022	2020-01-19
Identification of Drug-Disease Associations Using Information of Molecular Structures and Clinical Symptoms via Deep Convolutional Neural Network.	31998700	10.3389/fchem.2019.00924		2020-01-10
Alliance of Genome Resources Portal: unified model organism research platform.	31552413	10.1093/nar/gkz813		2020-01-08
ENdb: a manually curated database of experimentally supported enhancers for human and mouse.	31665430	10.1093/nar/gkz973		2020-01-08
gutMDisorder: a comprehensive database for dysbiosis of the gut microbiota in disorders and interventions.	31584099	10.1093/nar/gkz843		2020-01-08
LncTarD: a manually-curated database of experimentally-supported functional lncRNA-target regulations in human diseases.	31713618	10.1093/nar/gkz985		2020-01-08
PhenoModifier: a genetic modifier database for elucidating the genetic basis of human phenotypic variation.	31642469	10.1093/nar/gkz930		2020-01-08
SEAweb: the small RNA Expression Atlas web application.	31598718	10.1093/nar/gkz869		2020-01-08
The DisGeNET knowledge platform for disease genomics: 2019 update.	31680165	10.1093/nar/gkz1021		2020-01-08
The IUPHAR/BPS Guide to PHARMACOLOGY in 2020: extending immunopharmacology content and introducing the IUPHAR/MMV Guide to MALARIA PHARMACOLOGY.	31691834	10.1093/nar/gkz951		2020-01-08
The reactome pathway knowledgebase.	31691815	10.1093/nar/gkz1031		2020-01-08
The Year of the Rat: The Rat Genome Database at 20: a multi-species knowledgebase and analysis platform.	31713623	10.1093/nar/gkz1041		2020-01-08
A Probabilistic Matrix Decomposition Method for Identifying miRNA-Disease Associations		10.1007/978-3-030-60802-6_35	2-s2.0-85094137124	2020-01-01
A structured model for immune exposures.	32283555	10.1093/database/baaa016		2020-01-01
An intelligent healthcare monitoring framework using wearable sensors and social networking data		10.1016/j.future.2020.07.047	2-s2.0-85088916811	2020-01-01
Automated generation of gene summaries at the Alliance of Genome Resources.	32559296	10.1093/database/baaa037		2020-01-01
BiOnt: Deep learning using multiple biomedical ontologies for relation extraction		10.1007/978-3-030-45442-5_46	2-s2.0-85084182686	2020-01-01
CircR2Cancer: a manually curated database of associations between circRNAs and cancers.	33181824	10.1093/database/baaa085		2020-01-01
Clinical Trials Data Management in the Big Data Era		10.1007/978-3-030-59612-5_14	2-s2.0-85092095284	2020-01-01
CoCoScore: context-aware co-occurrence scoring for text mining applications using distant supervision.	31199464	10.1093/bioinformatics/btz490		2020-01-01
Computational Methods for Predicting Autism Spectrum Disorder from Gene Expression Data		10.1007/978-3-030-65390-3_31	2-s2.0-85101876845	2020-01-01
Discovery of significant mirna-biomarkers for breast cancer using decision tree classifier			2-s2.0-85085011212	2020-01-01
Evaluation of cross-ontology association rules weighted by term specificity		10.1504/IJDMB.2020.112856	2-s2.0-85100627443	2020-01-01
GenCLiP 3: Mining human genes’ functions and regulatory networks from pubmed based on co-occurrences and natural language processing		10.1093/bioinformatics/btz807	2-s2.0-85091844760	2020-01-01
GESgnExt: Gene Expression Signature Extraction and Meta-Analysis on Gene Expression Omnibus	30714937	10.1109/JBHI.2019.2896144	2-s2.0-85077521353	2020-01-01
Hybrid semantic recommender system for chemical compounds		10.1007/978-3-030-45442-5_12	2-s2.0-85084193067	2020-01-01
Jupyter notebook-based tools for building structured datasets from the Sequence Read Archive	32864105	10.12688/f1000research.23180.2	2-s2.0-85090101326	2020-01-01
Mass spectrometry searches using MASST.	31894142	10.1038/s41587-019-0375-9		2020-01-01
Matching biodiversity and ecology ontologies: Challenges and evaluation results		10.1017/S0269888920000132	2-s2.0-85082559769	2020-01-01
Omics-based Identification of Glycan Structures as Biomarkers for a Variety of Diseases	31622036	10.1002/minf.201900112	2-s2.0-85074403599	2020-01-01
Ontology Design for Pharmaceutical Research Outcomes		10.1007/978-3-030-54956-5_9	2-s2.0-85090094811	2020-01-01
Plasma protein biomarkers and their association with mutually exclusive cardiovascular phenotypes: the FIBRO-TARGETS case-control analyses.	31062082	10.1007/s00392-019-01480-4		2020-01-01
Predicting Associations Between Proteins and Multiple Diseases		10.1007/978-3-030-59491-6_36	2-s2.0-85092099420	2020-01-01
Predicting Metabolite-Disease Associations Based on Linear Neighborhood Similarity with Improved Bipartite Network Projection Algorithm		10.1155/2020/9342640	2-s2.0-85085939630	2020-01-01
Structured reviews for data and knowledge-driven research.	32283553	10.1093/database/baaa015		2020-01-01
The ICARUS Ontology: A general aviation ontology developed using a multi-layer approach		10.1145/3405962.3405983	2-s2.0-85091502415	2020-01-01
FibroAtlas: A Database for the Exploration of Fibrotic Diseases and Their Genes.	32082621	10.1155/2019/4237285		2019-12-30
Reconstruction of Cell-type-Specific Interactomes at Single-Cell Resolution.	31786210	10.1016/j.cels.2019.10.007		2019-12-18
Persistent Exposure to Fusobacterium nucleatum Triggers Chemokine/Cytokine Release and Inhibits the Proliferation and Osteogenic Differentiation Capabilities of Human Gingiva-Derived Mesenchymal Stem Cells.	31921705	10.3389/fcimb.2019.00429		2019-12-17
MeinteR: A framework to prioritize DNA methylation aberrations based on conformational and cis-regulatory element enrichment.	31844073	10.1038/s41598-019-55453-8		2019-12-16
LncDisAP: a computation model for LncRNA-disease association prediction based on multiple biological datasets.	31787106	10.1186/s12859-019-3081-1		2019-12-02
DAISY: A Data Information System for accountability under the General Data Protection Regulation.	31800037	10.1093/gigascience/giz140		2019-12-01
From DIKW pyramid to graph database: A tool for machine processing of nutritional epidemiologic research data		10.1109/BigData47090.2019.9006469	2-s2.0-85081317232	2019-12-01
Identifying gene function and module connections by the integration of multispecies expression compendia.	31754022	10.1101/gr.251983.119		2019-12-01
Interconnection of Biological Knowledge Using NikkajiRDF and Interlinking Ontology for Biological Concepts		10.1007/s00354-019-00074-y	2-s2.0-85074036742	2019-12-01
Ontology: Footstone for Strong Artificial Intelligence		10.24920/003701	2-s2.0-85077497713	2019-12-01
The JAX Synteny Browser for mouse-human comparative genomics.	31776723	10.1007/s00335-019-09821-4		2019-12-01
Towards better drug repositioning using joint learning		10.1109/INDICON47234.2019.9029004	2-s2.0-85083040077	2019-12-01
Standard operating procedure for curation and clinical interpretation of variants in cancer.	31779674	10.1186/s13073-019-0687-x		2019-11-29
Computational resources associating diseases with genotypes, phenotypes and exposures.	30102366	10.1093/bib/bby071		2019-11-27
Identifying Cancer genes by combining two-rounds RWR based on multiple biological data.	31760937	10.1186/s12859-019-3123-8		2019-11-25
Prioritizing candidate diseases-related metabolites based on literature and functional similarity.	31760947	10.1186/s12859-019-3127-4		2019-11-25
The Hearing Impairment Ontology: A Tool for Unifying Hearing Impairment Knowledge to Enhance Collaborative Research.	31766582	10.3390/genes10120960		2019-11-21
Prediction of disease-related metabolites using bi-random walks.	31730648	10.1371/journal.pone.0225380		2019-11-15
GBDTCDA: Predicting circRNA-disease Associations Based on Gradient Boosting Decision Tree with Multiple Biological Data Fusion.	31853227	10.7150/ijbs.33806		2019-11-08
MIENTURNET: an interactive web tool for microRNA-target enrichment and network-based analysis.	31684860	10.1186/s12859-019-3105-x		2019-11-04
Design and evaluation of conceptual ontologies for electrochemistry as a domain		10.1109/WIECON-ECE48653.2019.9019987	2-s2.0-85082121865	2019-11-01
Formatting biological big data for modern machine learning in drug discovery		10.1002/wcms.1408	2-s2.0-85059122170	2019-11-01
Identifying diseases that cause psychological trauma and social avoidance by Xgboost		10.1109/BIBM47256.2019.8983295	2-s2.0-85084330778	2019-11-01
Ontology Integration Programs Study Administration (PSA) System and Lecturer Performance Report (LPR) System		10.1109/CITSM47753.2019.8965328	2-s2.0-85082386425	2019-11-01
Pan-cancer whole-genome analyses of metastatic solid tumours.	31645765	10.1038/s41586-019-1689-y		2019-11-01
Drug repositioning through integration of prior knowledge and projections of drugs and diseases	30865257	10.1093/bioinformatics/btz182	2-s2.0-85070075176	2019-10-15
Benchmark of computational methods for predicting microRNA-disease associations.	31594544	10.1186/s13059-019-1811-3		2019-10-08
Bayesian approach to incorporating different types of biomedical knowledge bases into information retrieval systems for clinical decision support in precision medicine	31301513	10.1016/j.jbi.2019.103238	2-s2.0-85071518844	2019-10-01
Improving the classification of neuropsychiatric conditions using gene ontology terms as features	31025483	10.1002/ajmg.b.32727	2-s2.0-85065065399	2019-10-01
Predicting circRNA-Disease Associations Based on Improved Collaboration Filtering Recommendation System With Multiple Data.	31608124	10.3389/fgene.2019.00897		2019-09-25
Ontology based mining of pathogen-disease associations from literature.	31533864	10.1186/s13326-019-0208-2		2019-09-18
Determination of chemical-disease risk values to prioritize connections between environmental factors, genetic variants, and human diseases.	31323264	10.1016/j.taap.2019.114674		2019-09-15
Predicting circRNA-Disease Associations Based on circRNA Expression Similarity and Functional Similarity.	31572444	10.3389/fgene.2019.00832		2019-09-12
Using Twitter to Understand the Human Bowel Disease Community: Exploratory Analysis of Key Topics.	31411142	10.2196/12610		2019-08-15
BNO—An ontology for understanding the transittability of complex biomolecular networks		10.1016/j.websem.2019.01.002	2-s2.0-85060343336	2019-08-01
Building a biomedical ontology for chronic liver disease		10.1109/CITS.2019.8862104	2-s2.0-85074151662	2019-08-01
Exploring the dark genome: implications for precision medicine.	31270560	10.1007/s00335-019-09809-0		2019-08-01
Public data sources to support systems toxicology applications.	33604492	10.1016/j.cotox.2019.03.002		2019-08-01
ROBOT: A Tool for Automating Ontology Workflows.	31357927	10.1186/s12859-019-3002-3		2019-07-29
Building a biomedical ontology for respiratory tract infection		10.1145/3348445.3348461	2-s2.0-85073202725	2019-07-27
Predicting drug-induced transcriptome responses of a wide range of human cell lines by a novel tensor-train decomposition algorithm.	31510663	10.1093/bioinformatics/btz313		2019-07-15
