title	pmid	doi	scopus_eid	pub_date
DOSim: an R package for similarity between diseases based on Disease Ontology.	21714896	10.1186/1471-2105-12-266		2011-06-29
Ontologies of drug discovery and design for Neurology, Cardiology and Oncology	20642429	10.2174/138161210792389199	2-s2.0-77957956609	2010-10-21
Phenotype ontologies for mouse and man: bridging the semantic gap.	20427557	10.1242/dmm.002790		2010-05-01
Multi-faceted semantic clustering with text-derived phenotypes.	34600327	10.1016/j.compbiomed.2021.104904		2021-11-01
Gene clusters based on OLIG2 and CD276 could distinguish molecular profiling in glioblastoma.	34565408	10.1186/s12967-021-03083-y		2021-09-26
Risk Prediction of Cardiovascular Events by Exploration of Molecular Data with Explainable Artificial Intelligence.	34638627	10.3390/ijms221910291		2021-09-24
Atopic dermatitis or eczema? Consequences of ambiguity in disease name for biomedical literature mining	34213816	10.1111/cea.13981	2-s2.0-85111098808	2021-09-01
Predicting circRNA-disease associations based on autoencoder and graph embedding		10.1016/j.ins.2021.04.073	2-s2.0-85105792820	2021-09-01
TSMDA: Target and symptom-based computational model for miRNA-disease-association prediction.	34631283	10.1016/j.omtn.2021.08.016		2021-08-26
Ten simple rules for creating reusable pathway models for computational analysis and visualization.	34411100	10.1371/journal.pcbi.1009226		2021-08-19
An automated method to enrich consumer health vocabularies using GloVe word embeddings and an auxiliary lexical resource.	34458573	10.7717/peerj-cs.668		2021-08-09
A novel subnetwork representation learning method for uncovering disease-disease relationships	32946974	10.1016/j.ymeth.2020.09.002	2-s2.0-85092611083	2021-08-01
Development and application of the ocular immune-mediated inflammatory diseases ontology enhanced with synonyms from online patient support forum conversation.	34139439	10.1016/j.compbiomed.2021.104542		2021-08-01
IsoDA: Isoform-Disease Association Prediction by Multiomics Data Fusion	33826865	10.1089/cmb.2020.0626	2-s2.0-85112286113	2021-08-01
Mining a stroke knowledge graph from literature.	34325669	10.1186/s12859-021-04292-4		2021-07-29
Glycoinformatics Resources Integrated Through the GlySpace Alliance		10.1016/B978-0-12-819475-1.00107-3	2-s2.0-85118122082	2021-06-21
AISHE-Onto: A Semantic Model for Public Higher Education Universities		10.1145/3463677.3463750	2-s2.0-85108148310	2021-06-09
Germinating seed can sense low temperature for the floral transition and vernalization of winter rapeseed (Brassica rapa)	33902859	10.1016/j.plantsci.2021.110900	2-s2.0-85104089942	2021-06-01
Towards similarity-based differential diagnostics for common diseases.	33836447	10.1016/j.compbiomed.2021.104360		2021-06-01
An overview of graph databases and their applications in the biomedical domain.	34003247	10.1093/database/baab026		2021-05-18
A medical ontology informed user experience taxonomy to support co-creative workflows for authoring mixed reality medical education spaces		10.23919/iLRN52045.2021.9459388	2-s2.0-85113636955	2021-05-17
System biology and bioinformatics pipeline to identify comorbidities risk association: Neurodegenerative disorder case study.	33956862	10.1371/journal.pone.0250660		2021-05-06
Improved characterisation of clinical text through ontology-based vocabulary expansion.	33845909	10.1186/s13326-021-00241-5		2021-04-12
Metadata schemas and ontologies for building energy applications: A critical review and use case analysis		10.3390/en14072024	2-s2.0-85106494553	2021-04-01
Ontology-driven weak supervision for clinical entity classification in electronic health records.	33795682	10.1038/s41467-021-22328-4		2021-04-01
Modular genome-wide gene expression architecture shared by early traits of osteoporosis and atherosclerosis in the Young Finns Study.	33782480	10.1038/s41598-021-86536-0		2021-03-29
Identification of potential therapeutic target genes in pediatric acute leukemia of ambiguous lineage based on bioinformatics analysis		10.3969/j.issn.1674-8115.2021.03.006	2-s2.0-85105339181	2021-03-28
Diseasome and comorbidities complexities of SARS-CoV-2 infection with common malignant diseases.	33539530	10.1093/bib/bbab003		2021-03-22
A scalable random walk with restart on heterogeneous networks with Apache Spark for ranking disease-related genes through type-II fuzzy data fusion	33545331	10.1016/j.jbi.2021.103688	2-s2.0-85101012028	2021-03-01
Prediction of disease-associated circRNAs via circRNA–disease pair graph and weighted nuclear norm minimization		10.1016/j.knosys.2020.106694	2-s2.0-85098726098	2021-02-28
Nanoinformatics: Opportunities and challenges in the development and delivery of healthcare products in developing countries		10.1088/1755-1315/655/1/012018	2-s2.0-85102379311	2021-02-24
Application and evaluation of knowledge graph embeddings in biomedical data.	33816992	10.7717/peerj-cs.341		2021-02-18
SMR: Medical Knowledge Graph Embedding for Safe Medicine Recommendation		10.1016/j.bdr.2020.100174	2-s2.0-85099500391	2021-02-15
InContext: curation of medical context for drug indications.	33579375	10.1186/s13326-021-00234-4		2021-02-12
MeFSAT: a curated natural product database specific to secondary metabolites of medicinal fungi		10.1039/d0ra10322e	2-s2.0-85099730577	2021-01-12
HERB: a high-throughput experiment- and reference-guided database of traditional Chinese medicine.	33264402	10.1093/nar/gkaa1063		2021-01-08
SC2disease: a manually curated database of single-cell transcriptome for human diseases.	33010177	10.1093/nar/gkaa838		2021-01-08
TCRD and Pharos 2021: mining the human proteome for disease biology.	33156327	10.1093/nar/gkaa993		2021-01-08
Biomedical Ontologies to Guide AI Development in Radiology		10.1007/s10278-021-00527-1	2-s2.0-85118406974	2021-01-01
COVIDGraph: Connecting biomedical COVID-19 resources and computational biology models			2-s2.0-85113851722	2021-01-01
COVIDonto: An Ontology Model for Acquisition and Sharing of COVID-19 Data		10.1007/978-3-030-78428-7_18	2-s2.0-85111394334	2021-01-01
Data Summarization with Hierarchical Taxonomy		10.1145/3448016.3450578	2-s2.0-85108946159	2021-01-01
Deep Learning System for Biomedical Relation Extraction Combining External Sources of Knowledge		10.1007/978-3-030-72240-1_82	2-s2.0-85107337080	2021-01-01
Demographic Aware Probabilistic Medical Knowledge Graph Embeddings of Electronic Medical Records		10.1007/978-3-030-77211-6_48	2-s2.0-85111375457	2021-01-01
Inferring Potential CircRNA-Disease Associations via Deep Autoencoder-Based Classification.	33156515	10.1007/s40291-020-00499-y		2021-01-01
MRWMDA: A novel framework to infer miRNA-disease associations	33221377	10.1016/j.biosystems.2020.104292	2-s2.0-85097430251	2021-01-01
Ontology-driven multicriteria decision support for Victim evacuation		10.1142/S021962202150053X	2-s2.0-85114363392	2021-01-01
Towards Rare Disease Knowledge Graph Learning from Social Posts of Patients		10.1007/978-3-030-62066-0_44	2-s2.0-85102640128	2021-01-01
Identifying diseases that cause psychological trauma and social avoidance by GCN-Xgboost.	33323103	10.1186/s12859-020-03847-1		2020-12-16
Analysis of readability and structural accuracy in SNOMED CT.	33319711	10.1186/s12911-020-01291-y		2020-12-15
Towards semantic interoperability: finding and repairing hidden contradictions in biomedical ontologies.	33319712	10.1186/s12911-020-01336-2		2020-12-15
Informing epidemic (research) responses in a timely fashion by knowledge management - a Zika virus use case.	33148605	10.1242/bio.053934		2020-12-02
An interoperable UMLS terminology service using FHIR		10.3390/fi12110199	2-s2.0-85096653706	2020-11-01
Attributed heterogeneous network fusion via collaborative matrix tri-factorization		10.1016/j.inffus.2020.06.012	2-s2.0-85087277071	2020-11-01
Distribution of disease-causing germline mutations in coiled-coils implies an important role of their N-terminal region.	33060664	10.1038/s41598-020-74354-9		2020-10-15
High-throughput small molecule screening reveals Nrf2-dependent and -independent pathways of cellular stress resistance.	33008901	10.1126/sciadv.aaz7628		2020-10-02
Automated Mortality Prediction in Critically-ill Patients with Thrombosis using Machine Learning		10.1109/BIBE50027.2020.00048	2-s2.0-85099564257	2020-10-01
Scoring disease-microRNA associations by integrating disease hierarchy into graph convolutional networks		10.1016/j.patcog.2020.107385	2-s2.0-85084510157	2020-09-01
Creating Neuroscientific Knowledge Organization System Based on Word Representation and Agglomerative Clustering Algorithm.	33013345	10.3389/fninf.2020.00038		2020-08-18
Applying knowledge-driven mechanistic inference to toxicogenomics.	32387679	10.1016/j.tiv.2020.104877		2020-08-01
Representing and querying space object registration data using graph databases		10.1016/j.actaastro.2020.04.056	2-s2.0-85084374354	2020-08-01
The effect of compound kushen injection on cancer cells: Integrated identification of candidate molecular mechanisms.	32730293	10.1371/journal.pone.0236395		2020-07-30
A novel method for privacy preservation of health data stream		10.30534/ijatcse/2020/110942020	2-s2.0-85090265337	2020-07-01
Enrich rare disease phenotypic characterizations via a graph convolutional network based recommendation system		10.1109/CBMS49503.2020.00015	2-s2.0-85091133890	2020-07-01
GSimPy: A Python package for measuring group similarity		10.1016/j.softx.2020.100526	2-s2.0-85084959108	2020-07-01
IASiS open data graph: Automated semantic integration of disease-specific knowledge		10.1109/CBMS49503.2020.00049	2-s2.0-85091155480	2020-07-01
Network-principled deep generative models for designing drug combinations as graph sets.	32657357	10.1093/bioinformatics/btaa317		2020-07-01
Similar Disease Prediction with Heterogeneous Disease Information Networks	32603299	10.1109/TNB.2020.2994983	2-s2.0-85087432061	2020-07-01
pyMeSHSim: an integrative python package for biomedical named entity recognition, normalization, and comparison of MeSH terms.	32552728	10.1186/s12859-020-03583-6		2020-06-18
PRISM: A Platform for Imaging in Precision Medicine.	32479186	10.1200/CCI.20.00001		2020-06-01
Supervised learning is an accurate method for network-based gene classification.	32129827	10.1093/bioinformatics/btaa150		2020-06-01
BEAVR: a browser-based tool for the exploration and visualization of RNA-seq data.	32471392	10.1186/s12859-020-03549-8		2020-05-29
Constructing Disease Similarity Networks Based on Disease Module Theory	29993782	10.1109/TCBB.2018.2817624	2-s2.0-85044283137	2020-05-01
How Wikipedia disease information evolve over time? An analysis of disease-based articles changes		10.1016/j.ipm.2020.102225	2-s2.0-85079669690	2020-05-01
A Literature Review of Gene Function Prediction by Modeling Gene Ontology.	32391061	10.3389/fgene.2020.00400		2020-04-24
Prediction of circRNA-disease associations based on inductive matrix completion.	32241268	10.1186/s12920-020-0679-0		2020-04-03
Aralar Sequesters GABA into Hyperactive Mitochondria, Causing Social Behavior Deficits	32200800	10.1016/j.cell.2020.02.044	2-s2.0-85081653915	2020-03-19
Discovery of disease- and drug-specific pathways through community structures of a literature network.	31738408	10.1093/bioinformatics/btz857		2020-03-01
BioHackathon 2015: Semantics of data for life sciences and reproducible research.	32308977	10.12688/f1000research.18236.1		2020-02-24
Weighted matrix factorization on multi-relational data for LncRNA-disease association prediction	31226302	10.1016/j.ymeth.2019.06.015	2-s2.0-85068030135	2020-02-15
Pathogenic Gene Prediction Algorithm Based on Heterogeneous Information Fusion.	32117433	10.3389/fgene.2020.00005		2020-02-04
The Immune Epitope Database and Analysis Resource Program 2003-2018: reflections and outlook.	31761977	10.1007/s00251-019-01137-6		2020-02-01
DEEPScreen: high performance drug-target interaction prediction with convolutional neural networks using 2-D structural compound representations.	33209251	10.1039/c9sc03414e		2020-01-08
A distributed approach for parsing large-scale owl datasets			2-s2.0-85107268131	2020-01-01
Are we better off with just one ontology on the Web?		10.3233/SW-190379	2-s2.0-85079042941	2020-01-01
CIDO: The community-based coronavirus infectious disease ontology			2-s2.0-85101058720	2020-01-01
Collaborativehealth: Smart technologies to surveil outbreaks of infectious diseases through direct and indirect citizen participation		10.1007/978-3-030-51974-2_15	2-s2.0-85089622480	2020-01-01
Communication among medical information systems: Principles for elaborating definitions		10.20396/RDBCI.V18I0.8657089	2-s2.0-85093506096	2020-01-01
Covid-19 Ontology Engineering-Knowledge Modeling of Severe Acute Respiratory Syndrome Coronavirus 2 (SARS-CoV-2)		10.14569/IJACSA.2020.0111115	2-s2.0-85097486519	2020-01-01
Developing an arabic infectious disease ontology to include non-standard terminology			2-s2.0-85096581907	2020-01-01
Inferring Candidate CircRNA-Disease Associations by Bi-random Walk Based on CircRNA Regulatory Similarity		10.1007/978-3-030-53956-6_44	2-s2.0-85088743729	2020-01-01
Isoform-Disease Association Prediction by Data Fusion		10.1007/978-3-030-57821-3_5	2-s2.0-85090097834	2020-01-01
Learning graph-based embedding from EHRS for time-aware patient similarity			2-s2.0-85096462119	2020-01-01
Modelling medical information and knowledge with OWL and topic maps		10.1007/978-3-030-14132-5_21	2-s2.0-85063270968	2020-01-01
Observing errors and omissions in failure classification schemes			2-s2.0-85101622189	2020-01-01
Ontological Description of the Basic Skills of Surgery		10.1007/978-3-030-20454-9_58	2-s2.0-85067696031	2020-01-01
Ontologies and artificial intelligence systems for the cooperative smart farming ecosystem		10.1109/ACCESS.2020.3022763	2-s2.0-85096365320	2020-01-01
Parallel Learning of Weighted Association Rules in Human Phenotype Ontology		10.1007/978-3-030-48340-1_42	2-s2.0-85086252606	2020-01-01
Patient similarity via joint embeddings of medical knowledge graph and medical entity descriptions		10.1109/ACCESS.2020.3019577	2-s2.0-85091222398	2020-01-01
Text messaging-based medical diagnosis using natural language processing and fuzzy logic		10.1155/2020/8839524	2-s2.0-85104532134	2020-01-01
Utility of SNOMED CT in automated expansion of clinical terms in discharge summaries: Testing issues of coverage		10.1177/1833358320934528	2-s2.0-85088303338	2020-01-01
Computational Methods for Identifying Similar Diseases.	31678735	10.1016/j.omtn.2019.09.019		2019-12-06
SKF-LDA: Similarity Kernel Fusion for Predicting lncRNA-Disease Association.	31514111	10.1016/j.omtn.2019.07.022		2019-12-06
Text-mining clinically relevant cancer biomarkers for curation into the CIViC database.	31796060	10.1186/s13073-019-0686-y		2019-12-03
Integrated analysis identifying new lncRNA markers revealed in ceRNA network for tumor recurrence in papillary thyroid carcinoma and build of nomogram	31271223	10.1002/jcb.29273	2-s2.0-85073183078	2019-12-01
Identifying Alzheimer's disease-related proteins by LRRGD.	31760934	10.1186/s12859-019-3124-7		2019-11-25
Data-driven method to enhance craniofacial and oral phenotype vocabularies.	31668172	10.1016/j.adaj.2019.05.029		2019-11-01
Elucidation of MicroRNA-Gene Regulation in Human Cancer with Integrative Network Models		10.1109/BIBM47256.2019.8983024	2-s2.0-85084336595	2019-11-01
Mining Association Rules from Disease Ontology		10.1109/BIBM47256.2019.8983022	2-s2.0-85084335391	2019-11-01
Two novel genetic variants in the STK38L and RAB27A genes are associated with glioma susceptibility	30714141	10.1002/ijc.32179	2-s2.0-85071468908	2019-11-01
Dissecting the Shared and Context-Dependent Pathways Mediated by the p140Cap Adaptor Protein in Cancer and in Neurons.	31681758	10.3389/fcell.2019.00222		2019-10-15
miR2Diabetes: A Literature-Curated Database of microRNA Expression Patterns, in Diabetic Microvascular Complications.	31601051	10.3390/genes10100784		2019-10-09
Explainable learning for disease risk prediction based on comorbidity networks		10.1109/SMC.2019.8914644	2-s2.0-85076776708	2019-10-01
DbCID: A manually curated resource for exploring the driver indels in human cancer	30016397	10.1093/bib/bby059	2-s2.0-85069432351	2019-09-27
Ontological and Non-Ontological Resources for Associating Medical Dictionary for Regulatory Activities Terms to SNOMED Clinical Terms With Semantic Properties.	31551780	10.3389/fphar.2019.00975		2019-09-10
HPO2Vec+: Leveraging heterogeneous knowledge resources to enrich node embeddings for the Human Phenotype Ontology.	31255713	10.1016/j.jbi.2019.103246		2019-08-01
Inferring disease and pathway associations of long non-coding RNAs using heterogeneous information network model	31617466	10.1142/S0219720019500203	2-s2.0-85073433491	2019-08-01
Research on adoption of gene-disease identification and recognition phenotype process in High-Performance Computing and Applications (HPCA) research		10.1109/HPCC/SmartCity/DSS.2019.00047	2-s2.0-85073523254	2019-08-01
Exploring the Potential Role of Rosmarinic Acid in Neuronal Differentiation of Human Amnion Epithelial Cells by Microarray Gene Expression Profiling.	31396047	10.3389/fnins.2019.00779		2019-07-24
Where to search top-K biomedical ontologies?	29579141	10.1093/bib/bby015		2019-07-19
Prioritizing target-disease associations with novel safety and efficacy scoring methods.	31285471	10.1038/s41598-019-46293-7		2019-07-08
Disease gene prediction for molecularly uncharacterized diseases.	31276496	10.1371/journal.pcbi.1007078		2019-07-05
Enhancing ontology-driven diagnostic reasoning with a symptom-dependency-aware Naïve Bayes classifier.	31196129	10.1186/s12859-019-2924-0		2019-06-13
Analysis of the role of DAMTC in lung adenocarcinoma cells based on the DNA microarrays.	31186684	10.3892/ol.2019.10146		2019-06-01
Characterization of diseases based on phenotypic information through knowledge extraction using public sources		10.1109/CBMS.2019.00124	2-s2.0-85071031503	2019-06-01
GeneSurrounder: network-based identification of disease genes in expression data.	31060502	10.1186/s12859-019-2829-y		2019-05-06
A Novel Method for Predicting Disease-Associated LncRNA-MiRNA Pairs Based on the Higher-Order Orthogonal Iteration.	31191710	10.1155/2019/7614850		2019-05-02
Document-level attention-based BiLSTM-CRF incorporating disease dictionary for disease named entity recognition	31003175	10.1016/j.compbiomed.2019.04.002	2-s2.0-85064312088	2019-05-01
Technological Innovations in Disease Management: Text Mining US Patent Data From 1995 to 2017.	31038462	10.2196/13316		2019-04-30
Population Levels Assessment of the Distribution of Disease-Associated Variants With Emphasis on Armenians - A Machine Learning Approach.	31105750	10.3389/fgene.2019.00394		2019-04-26
The cell line ontology-based representation, integration and analysis of cell lines used in China.	31272367	10.1186/s12859-019-2724-6		2019-04-25
The multiplex network of human diseases.	31044086	10.1038/s41540-019-0092-5		2019-04-23
CSgator: an integrated web platform for compound set analysis.	30830479	10.1186/s13321-019-0339-6		2019-03-04
Seeing the whole picture: integrated pre-surgery reports with PreOptique.	30832727	10.1186/s13326-019-0197-1		2019-03-04
Prediction of diabetes patient stage using ontology based machine learning system		10.1109/ICSCAN.2019.8878831	2-s2.0-85074749747	2019-03-01
Prediction of lncRNA-disease associations by integrating diverse heterogeneous information sources with RWR algorithm and positive pointwise mutual information.	30782113	10.1186/s12859-019-2675-y		2019-02-19
A scoping review of ontologies related to human behaviour change	30944444	10.1038/s41562-018-0511-4	2-s2.0-85060111072	2019-02-01
GlyConnect: Glycoproteomics Goes Visual, Interactive, and Analytical	30574787	10.1021/acs.jproteome.8b00766	2-s2.0-85060944285	2019-02-01
A Gene Family-led Meta-Analysis of Drug-Target Interactions		10.1109/BIBM.2018.8621087	2-s2.0-85062523153	2019-01-21
A Novel Method for Identifying Alzheimer's Disease-related Proteins		10.1109/BIBM.2018.8621492	2-s2.0-85062572780	2019-01-21
RADAR: Representation Learning across Disease Information Networks for Similar Disease Detection		10.1109/BIBM.2018.8621436	2-s2.0-85062518436	2019-01-21
SleBioRepo: A curated database of gene expression levels, in systematic lupus erythematosus		10.1109/BIBM.2018.8621337	2-s2.0-85062489780	2019-01-21
Conserved Disease Modules Extracted From Multilayer Heterogeneous Disease and Gene Networks for Understanding Disease Mechanisms and Predicting Disease Treatments.	30713550	10.3389/fgene.2018.00745		2019-01-18
MetSigDis: A manually curated resource for the metabolic signatures of diseases	28968812	10.1093/bib/bbx103	2-s2.0-85060178026	2019-01-18
Systematic review regulatory principles of non-coding RNAs in cardiovascular diseases	28968629	10.1093/bib/bbx095	2-s2.0-85057250187	2019-01-18
Global analysis of N6-methyladenosine functions and its disease association using deep learning and network-based methods.	30601803	10.1371/journal.pcbi.1006663		2019-01-02
A computational system based on ontologies to automate the mapping process of medical reports into structured databases		10.1016/j.eswa.2018.08.004	2-s2.0-85051383431	2019-01-01
A smart mobile health application for mauritius		10.1007/978-981-13-3338-5_31	2-s2.0-85061620890	2019-01-01
AWX: An integrated approach to hierarchical-multilabel classification		10.1007/978-3-030-10925-7_20	2-s2.0-85061112371	2019-01-01
BeRST: An engine and tool for exploring biomedical entities and relationships		10.1049/cje.2019.05.007	2-s2.0-85069567653	2019-01-01
Drug side-effect prediction using heterogeneous features and bipartite local models		10.32604/cmc.2019.05536	2-s2.0-85075264979	2019-01-01
Generating knowledge graph paths from textual definitions using sequence-to-sequence models			2-s2.0-85085580987	2019-01-01
NCPCDA: Network consistency projection for circRNA-disease association prediction		10.1039/c9ra06133a	2-s2.0-85073735634	2019-01-01
NCPHLDA: A novel method for human lncRNA-disease association prediction based on network consistency projection	31686064	10.1039/c9mo00092e	2-s2.0-85075959884	2019-01-01
Semantic lifting and reasoning on the personalised activity big data repository for healthcare research		10.1504/IJWET.2019.102870	2-s2.0-85073231251	2019-01-01
Text mining for drug discovery	30848465	10.1007/978-1-4939-9089-4_13	2-s2.0-85062600926	2019-01-01
The feasibility of ontological description of medical device connectivity for laparoscopic surgery		10.1007/978-3-319-94373-2_10	2-s2.0-85049205309	2019-01-01
Towards smart healthcare management based on knowledge graph technology		10.1145/3316615.3316678	2-s2.0-85066023878	2019-01-01
Using Ontologies to Express Prior Knowledge for Genetic Programming		10.1007/978-3-030-29726-8_23	2-s2.0-85072870566	2019-01-01
FoodOn: a harmonized food ontology to increase global food traceability, quality control and data integration.	31304272	10.1038/s41538-018-0032-6		2018-12-18
From Matrices to Knowledge: Using Semantic Networks to Annotate the Connectome.	30581382	10.3389/fnana.2018.00111		2018-12-07
Variant information systems for precision oncology.	30463544	10.1186/s12911-018-0665-z		2018-11-21
RESKO: Repositioning drugs by using side effects and knowledge from ontologies		10.1016/j.knosys.2018.06.017	2-s2.0-85049759191	2018-11-15
A histone acetylome-wide association study of Alzheimer’s disease identifies disease-associated H3K27ac differences in the entorhinal cortex	30349106	10.1038/s41593-018-0253-7	2-s2.0-85055464133	2018-11-01
Glycomics@ExPASy: Bridging the Gap.	30097532	10.1074/mcp.RA118.000799		2018-11-01
DbCPM: A manually curated database for exploring the cancer passenger mutations		10.1093/bib/bby105	2-s2.0-85081542859	2018-10-30
How is the Doctor Feeling? ICU Provider Sentiment is Associated with Diagnostic Imaging Utilization	30441248	10.1109/EMBC.2018.8513325	2-s2.0-85056630829	2018-10-26
Towards the Establishment of a Biomedical Ontology for the Primary Sjögren's Syndrome	30441255	10.1109/EMBC.2018.8513349	2-s2.0-85056651284	2018-10-26
A unified semantic sports concepts classification as a key device for multidimensional sports analysis		10.1109/SMAP.2018.8501868	2-s2.0-85057107539	2018-10-19
Arena-Idb: a platform to build human non-coding RNA interaction networks.	30367585	10.1186/s12859-018-2298-8		2018-10-15
A graph based model for multiple biological data sources integration		10.1145/3286606.3286826	2-s2.0-85059907150	2018-10-10
From Affective Science to Psychiatric Disorder: Ontology as a Semantic Bridge.	30349491	10.3389/fpsyt.2018.00487		2018-10-08
Automated ontology generation framework powered by linked biomedical ontologies for disease-drug domain	30337066	10.1016/j.cmpb.2018.08.010	2-s2.0-85052192591	2018-10-01
Risk prediction using natural language processing of electronic mental health records in an inpatient forensic psychiatry setting	30118855	10.1016/j.jbi.2018.08.007	2-s2.0-85052639346	2018-10-01
Designing a mobile recommender system for treatment adherence improvement among hypertensives		10.23919/FRUCT.2018.8468269	2-s2.0-85055542573	2018-09-19
The Pathogenesis of Atherosclerosis Based on Human Signaling Networks and Stem Cell Expression Data.	30416382	10.7150/ijbs.27896		2018-09-07
An Innovative Framework for Bioimage Annotation and Studies	29094319	10.1007/s12539-017-0264-1	2-s2.0-85050531807	2018-09-01
Therapeutic targeting of the premetastatic stage in human lung-to-brain metastasis	29986997	10.1158/0008-5472.CAN-18-1022	2-s2.0-85052760256	2018-09-01
The CAIRR Pipeline for Submitting Standards-Compliant B and T Cell Receptor Repertoire Sequencing Studies to the National Center for Biotechnology Information Repositories.	30166985	10.3389/fimmu.2018.01877		2018-08-16
EAPB: entropy-aware path-based metric for ontology quality.	30097014	10.1186/s13326-018-0188-7		2018-08-10
